Latex_files/full/expanded/200209303.tex,Introduction,Related Work,Dataset Description,Conclusion,Appendix Statistics,Appendix Word lists
Latex_files/full/expanded/210704952.tex,Introduction,Related Work,Methodology,Experiments and Results,Ablation Study,Conclusion,Supplementary Section
Latex_files/full/expanded/200302601.tex,Introduction,Preliminaries,Monotonic Fuzzy textitkNearest Neighbors,Experimental framework,Results and analysis,Conclusion
Latex_files/full/expanded/190905372.tex,Introduction,An Overview of Overton,Evaluation,Related Work,Conclusion and Future Work
Latex_files/full/expanded/200505135.tex,Parameter optimization,Estimating lesion probabilities,Introduction,Contrastadaptive wholebrain segmentation,Modeling lesions,revisionEvaluation datasets and benchmark methods,Results,Discussion and conclusion,Acknowledgments,Conflicts of interest,Parameter optimization in SAMSEG
Latex_files/full/expanded/190707638.tex,Introduction,Proposed Method,Modified bAbI dialog tasks,Experiments and Results,Related Work,Conclusion and Future Work,Appendix Training Details,Extended Results
Latex_files/full/expanded/180609431.tex,Introduction,Propagating Uncertainty through the tanh,Probabilistic Echo State Networks,Experimental Evaluation,Conclusions,Supplementary Material
Latex_files/full/expanded/210203280.tex,Introduction,MultiCompartment SNN Model,Training,Experiments,Conclusion
Latex_files/full/expanded/201114808.tex,Introduction,Preliminaries,Lightweight Network Design,Network Compression,HardwareAware Neural Architecture Search,Adaptive Models,Discussion and Envisions,Conclusion
Latex_files/full/expanded/170704957.tex,Introduction,Abductive Reasoning In Goaldirected ASP Systems,Physician Advisory System for HF management,Automatic Checking of Adherence to Guidelines,Related Works,Conclusions and Future Work
Latex_files/full/expanded/181206199.tex,Introduction,Related Work,The ContextEvent Relation Corpus,Features,Experiment,Conclusion,Acknowledgements
Latex_files/full/expanded/200609267.tex,Introduction,Related work,Contribution,Approach,Results and Discussion,Conclusion
Latex_files/full/expanded/211003691.tex,Introduction,Background,Model Design,Experiments,Results  Discussion,Conclusion,Acknowledgement
Latex_files/full/expanded/201011980.tex,Introduction,Preliminaries,Joint Learning based on SelfDistillation methodname,Experiments and Results,Conclusion
Latex_files/full/expanded/170908292.tex,INTRODUCTION,RELATED WORK,DATASET COLLECTION,DETECTION METHODS,VISUAL SERVOING CONTROLLER,EXPERIMENTAL RESULTS,CONCLUSIONS
Latex_files/full/expanded/200202080.tex,Introduction,Related Work,Temporaladaptive Hierarchical Reinforcement Learning,Experiments,Conclusion
Latex_files/full/expanded/180206006.tex,Introduction,Related Work,From MultiSpeaker Generative Modeling to Voice Cloning,Experiments,Conclusions,Detailed speaker encoder architecture,Voice cloning test sentences,Speaker verification model,Implications of attention,Speaker embedding space learned by the encoder,Similarity scores
Latex_files/full/expanded/190502940.tex
Latex_files/full/expanded/170505098.tex,Introduction,Ordinal Aspect Bias Model,Experiments,Related Work,Conclusion
Latex_files/full/expanded/190709426.tex,Introduction,Preliminaries,Paracoherent Extensions,Relation with Logic Programming,Computational Complexity,Related Work,Conclusion
Latex_files/full/expanded/201202792.tex,Introduction,Background and Motivation,Weight Update Skipping WUS,Evaluation,Conclusions
Latex_files/full/expanded/161007119.tex,Introduction,Problem Formulation,Our Method,Experimental Evaluation,Conclusion
Latex_files/full/expanded/201005771.tex,Introduction,Background,Available datasets,Modeling,Experiments,Results,Conclusion
Latex_files/full/expanded/190108585.tex,Experimental results,Conclusion,Introduction,Preliminaries,Graph heat mixture model,Inference Algorithm
Latex_files/full/expanded/200901625.tex,Introduction,Related Work,Background,The AED Algorithm,The DPSA Algorithm,Empirical Results ,Conclusions and Future Work
Latex_files/full/expanded/210908266.tex,Introduction,Preliminaries,Slowdown Attack,Experiments,Related Work,Discussion,Technical details for PGD,Experimental details,Additional results on longterm effectiveness
Latex_files/full/expanded/181110276.tex,Introduction,Related work,Data samples,Model description,Results with VAE,How to deploy a VAE for BSM detection,Conclusions and outlook,Comparison with AutoEncoder
Latex_files/full/expanded/181205692.tex,Introduction,Preliminaries,Proposed method,Experiments,Experimental setup
Latex_files/full/expanded/200410404.tex,Introduction,Dataset and Problem Definition,Automatic Evaluation,Baselines,CoarsetoFine Generation,Experiments,Related Work,Conclusion,Acknowledgement,Dataset Examples,Logical Operation Distribution,Semantic Parser,Qualitative Example
Latex_files/full/expanded/191107198.tex,Introduction,Related work,Randomized smoothing as an adversarial defense,Training a smoothed classifier,Experiments,Conclusions,Defense by random noise injection ,Additional results
Latex_files/full/expanded/191013148.tex,Introduction,Tensor Ring Induced Prior labelsecTRIP,Conditional Generation labelseccond,Related Work labelsecrelated,Experiments labelsecexperiments,Discussion labelsecdiscussion,Acknowledgements,Generative Models With Tensor Ring Induced Prior labelsecgen,Derivations for onedimensional conditional distributions,Calculation of marginal probabilities in Tensor Ring,Model architecture,Implementation details,Impact of core size
Latex_files/full/expanded/210702961.tex,Introduction,Preliminaries,Proposed Method,Numerical Examples,Conclusions and Future Works
Latex_files/full/expanded/190705380.tex,Introduction,Related Work,Our Framework,Experiments,Conclusions,Acknowledgments
Latex_files/full/expanded/180900542.tex,Introduction,Related Work,The Data,Machine learning methods,Experimental Setup,Results,Conclusion
Latex_files/full/expanded/210317230.tex,Introduction,Related Work,Class Incremental Learning Setups,Approach,Experiments,Conclusion,Accuracy Over the Tasks in Various CIL Setups,Metrics Details,Class Distribution over Tasks
Latex_files/full/expanded/191211540.tex,Introduction,Review of NS and FCM,Proposed Method,Experimental Results,Conclusion
Latex_files/full/expanded/210406922.tex,INTRODUCTION,RELATED WORK,PRELIMINARIES,CONSTRAINED POLICY OPTIMIZATION UNDER MODEL UNCERTAINTY,EVALUATION ON CONSTRAINED ROBOT LOCOMOTION,CONCLUSION
Latex_files/full/expanded/210203311.tex,Introduction,Online bin packing model and predictions,Profile packing,A hybrid algorithm,Extensions,Experimental evaluation,Conclusion,Details on the algorithms
Latex_files/full/expanded/210206483.tex,Introduction,Approaching Apprenticeship and Imitation Offline,Approximate Variational Reward Imitation Learning,Experiments,Conclusions,Experimental Setup,Proofs
Latex_files/full/expanded/201208254.tex,Introduction,Related Work,Background and Concepts,Design of EmmA,Technology,Typical usage of EmmA,First Evaluation,Summary and Future Work,Acknowledgements
Latex_files/full/expanded/171205556.tex,Introduction,Relevant Work,Problem Statement,Algorithm,Experiments,Discussion and Future Work,Supplementary material
Latex_files/full/expanded/190911611.tex,Introduction,Background,From analogies to knowledge graph relations,Evidence linking knowledge graph and word embeddings,Conclusion,Categorising NELL995 Relations,Splitting the NELL995 Dataset,Implementation Details,Krackhardt Hierarchy Score,Symmetry Score,Other Predicted Facts
Latex_files/full/expanded/210601331.tex,Introduction,Preliminaries,MultiObjectivization in Software Configuration Tuning,Experimental Setup,Evaluation Results,Discussion,Related Work,Conclusion and Future Work
Latex_files/full/expanded/210900137.tex,Introduction,Background Implicit Model Training and Inference,Intriguing Properties of Implicit vs Explicit Models,Policy Learning Results,Theoretical Insight Universal Approximation with Implicit Models,Related Work,Conclusion,Contributions Statement,EnergyBased Model Training and Implicit Inference Details,Additional Experimental Details and Analysis,Policy Learning Results Overview and Protocol,Model Architectures,Proofs,Theory Implications and Discussion,Limitations
Latex_files/full/expanded/200307370.tex,Why Do We Need Explanations,The Current State of Explanations,Direction I Augmenting Human Mental Models,Direction II Towards HumanCentered Explanations,Conclusion
Latex_files/full/expanded/171011122.tex,Introduction,Related Work,Data Description,Methods,Experiments And Results,Future Direction,Conclusion,Appendix,Realworld considerations,Algorithm references
Latex_files/full/expanded/210500211.tex,ARMarkov modelling for prognostics,Markov switching model with soft prior General formulation,Illustration on turbofan datasets,Conclusion and perspectives
Latex_files/full/expanded/13108243.tex,Introduction,Parallel active learning,Active learning with delays,Experiments,Conclusion,Generalization bounds for delayed IWAL,Label complexity lemma
Latex_files/full/expanded/191106472.tex,Introduction,Methods,Results,Conclusion,Model Description
Latex_files/full/expanded/210303436.tex,Optimization in CMTL Algorithm,Risk Factor Analysis  Additional Results,Outcome Variable Distribution in FHS and BRFSS datasets,Optimization in MTL Algorithm
Latex_files/full/expanded/210812680.tex,Introduction,Projection patterns in LLE,Numerical examples for high dimensional data,Conclusion
Latex_files/full/expanded/210213403.tex,Introduction,Artificial neural networks and Gaussian processes for regression,Artificial neural networks for multifidelity regression,Numerical results I benchmark test cases,Numerical results II application to parametrized PDEs,Conclusions
Latex_files/full/expanded/170803995.tex,Introduction,Related Work,Supervised Word Vectors for Sentiment Analysis,Experimental Evaluation and Results,Conclusions and Future work
Latex_files/full/expanded/200300355.tex,INTRODUCTION,BACKGROUND,SURVIVAL CLUSTER ANALYSIS,EXPERIMENTS,CONCLUSIONS
Latex_files/full/expanded/210303012.tex,Traditional TSP Solvers,Neural Network Solvers,Proposed Architecture,Architecture Comparison,Decoding Technique,Numerical Experiments,Discussion,Conclusion,Acknowledgement
Latex_files/full/expanded/210906598.tex,Introduction,Key Principles of Data Collection,Tension between Data Collection Principles,Responsible Data Use Checklist,Cant We Just Defer to IRB,Challenges,Conclusion,Acknowledgements
Latex_files/full/expanded/210407177.tex,Introduction,Background and Motivation,System Design,Implementation and Performance Evaluation,Related Work,Conclusion
Latex_files/full/expanded/201008115.tex,Introduction,Related work,Dataset Description,Proposed approach,Experiments and results,Conclusion
Latex_files/full/expanded/210910380.tex,Introduction,Problem Setting,Related Work,Learning Deep Policies for Matching,Experimental Setup,Experimental Results,Conclusion,Implementation Details,Training and Evaluation,Dataset Generation Details,Finding Optimal Solutions Offline,Permutation Invariance,Agreement Plots,Extension to other OBM Variants
Latex_files/full/expanded/190513214.tex,Introduction,Related Work,Design Spaces,Proposed Methodology,Case Study NAS,Conclusion
Latex_files/full/expanded/190805490.tex,Introduction,Related Work,Method,Evaluation and Experiments,Conclusions and Future Work
Latex_files/full/expanded/180602623.tex,Introduction,Problem Formulation,Model Framework,Experiments,Related Work,Conclusions
Latex_files/full/expanded/160405819.tex,Introduction,Regularizers for complex cost structures,Numerical experiments,Conclusions and discussion
Latex_files/full/expanded/190803932.tex,Introduction,Problem Definition,Identifying Causal Orders among Observed Variables,Identifying Total Causal Effects among Observed Variables,Experiments,Conclusions
Latex_files/full/expanded/210610272.tex,Introduction,Related Work,Background,On Implementing and Training RCPMs,Experiments,Conclusion,Manifold Operations,Proof of cconcavity of the multilayer potential,Additional experimental and implementation details
Latex_files/full/expanded/170303254.tex,Introduction,Method,Results and Discussion,Concluding Remarks
Latex_files/full/expanded/200307581.tex,Introduction,Related Work,Method,Experiments,Conclusion,Implementation Details
Latex_files/full/expanded/201212373.tex,Introduction,SSD and HDD Dataset,Drive Failure and Repair,Symptoms and Causes of Failures,Failure Prediction,Related Work,Conclusion
Latex_files/full/expanded/191210762.tex,Introduction,Related Work,Preliminaries,Method,Computational Experiments,Discussions and Limitations,Conclusions and Future Work
Latex_files/full/expanded/201110678.tex,Introduction,Related work,Method,Experiments,Conclusion,Supplementary Material
Latex_files/full/expanded/190604980.tex,Introduction,Unsupervised Extractive QA,Experiments,Related Work,Discussion,Conclusion,Appendices
Latex_files/full/expanded/211009164.tex,Introduction,Relevant Results,Proposed Approach MemAOPGD,Numerical Experiment,Conclusion
Latex_files/full/expanded/191210917.tex,Introduction,Related Work,FasterSeg Faster Realtime Segmentation,Experiments,Conclusion,Stem and Head Module,Branch Selection Criterion,GumbelSoftmax Trick for Searching Expansion Ratios,Normalized scalars alpha beta gamma,Latency Estimation,Training,Benchmark Datasets,Architecture Search Implementations,FasterSeg Structure,Visualization
Latex_files/full/expanded/200701884.tex,Introduction,Time series causal discovery in the presence of latent confounders,Latent PCMCI,Numerical experiments,Application to real data,Discussion and future work,Relevant graphical terminology and notation,Some background on FCI,LPCMCIPAGs,Orientation rules for LPCMCIPAGs,Pseudocode for Algorithms refalgoancestral and refalgononancestral,A variant of LPCMCI without Algrefalgononancestral,Definition and relevance of apds and napds sets,Proofs,Further numerical experiments,Figures illustrating the application to the real data example,Noncompleteness of FCI with majority rule
Latex_files/full/expanded/210508655.tex,Introduction,Formatting your Response
Latex_files/full/expanded/190711094.tex
Latex_files/full/expanded/210515203.tex,Introduction,Related Work,Method,Experiments,Conclusion,Details of MiT Series,More Qualitative Results on Mask Predictions,More Visualization on  Effective Receptive Field
Latex_files/full/expanded/170704207.tex,Introduction,Related Work,Methodology,Results,Discussion,Conclusions,Acknowledgements
Latex_files/full/expanded/210504532.tex,Introduction,Methods,RESULTS,Conclusion
Latex_files/full/expanded/190903835.tex,Introduction,Methodologies,Experiment,Related Work,Conclusions
Latex_files/full/expanded/200500116.tex,Motivation,Literature Review,Problem Statement,Methodology,Results and Discussion,Conclusion and Future Work,Acknowledgment
Latex_files/full/expanded/180402958.tex,Introduction,Related work,Background,GANs for extreme image compression,Experiments,Results,Conclusion,Comparison with Stateoftheart,Training Details,Data set and Preprocessing Details,Compression Details,Architecture Details,Visuals
Latex_files/full/expanded/200802492.tex,Introduction,Related Work,Methodology,Experiments,Conclusion
Latex_files/full/expanded/210209704.tex,Introduction,Notation and Problem Definition,Our New Optimization Problem and Invexity,Our Theoretical Analysis,Experimental Validation,Proof of Lemma refleminvexity,Proof of Lemma reflemsample positive definite,Proof of Lemma reflemsample mutual incoherence condition,Proof of Lemma reflemws primal dual,Proof of Lemma reflembound Xse and Xsce,Proof of Lemma reflembound on Delta,Proof of Corollary refcorprimal dual vairables,Quality of Solution with bias parameter gamma,Our Assumptions Hold for Finite Samples,Details of Experimental Validation,Real World Experiment
Latex_files/full/expanded/210609241.tex,Conclusion,Proof of the First Zonklar Equation,,Introduction
Latex_files/full/expanded/180905524.tex,Introduction,Related Work,Technical Background,Extended Encoder Decoder Architecture,Experiments and Discussion,Conclusion
Latex_files/full/expanded/210507426.tex,Introduction,Related Work,Methodology and System Design,Experiment,Conclusion and Discussions
Latex_files/full/expanded/200705499.tex,Introduction,Preliminaries,Methods,Experimental Design,Results,Conclusions
Latex_files/full/expanded/210601586.tex,Introduction,Related Work,Model,Dataset,Experiments,Conclusion
Latex_files/full/expanded/200303196.tex,Introduction,Related Work,Federated Continual Learning with FedWeIT,Experiments,Conclusion,Acknowledgement,Experimental Details,FedWeIT for Asynchronous Federated Continual Learning,Additional Experimental Results
Latex_files/full/expanded/200405574.tex,Introduction,Background,Problem description and Threat model,Private training,Private prediction,Validation,Conclusion,Introduction
Latex_files/full/expanded/210708170.tex
Latex_files/full/expanded/200605380.tex,Motivations,Notes on data Acquisition,Analysis of the number of tropes used in the films,Analysis of the number of films where the tropes appear,Conclusions,Bibliography
Latex_files/full/expanded/210905238.tex,Introduction,Background,The Proposed Method,Related Work,Experiments,Analysis,Conclusion and Future Work
Latex_files/full/expanded/210306332.tex,Introduction,A stateoftheart LFQA system,Analysis,Conclusion,Appendices for Hurdles to Progress in Longform Question Answering
Latex_files/full/expanded/211002414.tex,INTRODUCTION,Related Work,Background,Imaginary Hindsight Experience Replay IHER,Experiments,Challenges in ModelBased RL,Conclusion
Latex_files/full/expanded/180700202.tex,Introduction,Review and Task Description,Conclusion
Latex_files/full/expanded/200408599.tex,Introduction,Logic For Computation,Tractable Circuits,Logic For Learning From Data and Knowledge,Logic For Meta Reasoning,Conclusion and Outlook
Latex_files/full/expanded/170510834.tex,Introduction,Related Work,Methodology,Results and Discussion,Conclusion
Latex_files/full/expanded/210104526.tex,Introduction,Related Work,Simulation Framework,Designing test user models,Empirical Case Studies,Discussion,Conclusion
Latex_files/full/expanded/190605737.tex,Introduction,Related Work,Approach,Evaluation,Conclusion and Future Work
Latex_files/full/expanded/210301071.tex,Introduction,Theoretical Background,The vanilla VAE and its problems,TwoStage VAE,Regularized VAE RAE,Hierarchical Variational Autoencoder labelsecHVAE,Experimental setting,Numerical results,Conclusions,Examples of generated images
Latex_files/full/expanded/181102656.tex,Introduction,Quaternion Algebra,Quaternion convolutional encoderdecoder,Experiments and results,Conclusion
Latex_files/full/expanded/151102583.tex,Introduction,Design of Deep Architecture,Conclusions,Experiments
Latex_files/full/expanded/190709478.tex,Introduction,Related Work,The Proposed Method,Datasets  Performance Measures,Experiments  Results,Conclusion
Latex_files/full/expanded/200210947.tex,Introduction,Related Works,Problem Statement,Experiments,Conclusion
Latex_files/full/expanded/210208021.tex,Introduction,Methodology,Experiments and Discussion,Conclusions,Compliance with Ethical Standards,Acknowledgments
Latex_files/full/expanded/14102786.tex,Introduction,SVDNMF for the initialization of NMF,Numerical experiments,Acknowledgement
Latex_files/full/expanded/200509645.tex,Introduction,Preliminaries,Variation in Subtree Size,Loops,Experiments,Related Work,Discussion,Conclusion
Latex_files/full/expanded/210503050.tex,textitfAshIon Research,textitfAshIon Application,Challenges,Opportunities
Latex_files/full/expanded/171009288.tex,Introduction,FCNCRF Network,Adversarial FCNCRF Nets,Experiments,Conclusion
Latex_files/full/expanded/210812149.tex,Introduction,Related Work,Temporal Description Logic, Reducing Temporal  DLite to DLite ,Inconsistency Detection and Repair in TKBs,Conclusion and Future Work
Latex_files/full/expanded/210105891.tex,Introduction,Conclusion
Latex_files/full/expanded/210910057.tex,Introduction,Related Work,Proposed methods,Experiments,Conclusions
Latex_files/full/expanded/150504778.tex,Introduction,Background,Finding a dual certificate,Proof of main result
Latex_files/full/expanded/171007457.tex,Introduction,Related work,Deep Wasserstein Embedding DWE,Numerical experiments,Conclusion and discussion
Latex_files/full/expanded/160906582.tex,Introduction,Preliminaries,Mobility Analytics using Aggregate Locations,A System for PrivacyFriendly Mobility Analytics,Related Work,Conclusion
Latex_files/full/expanded/170503556.tex,Introduction,Related Work,Relevancebased Embedding,Experiments,Conclusions and Future Work
Latex_files/full/expanded/180607603.tex,Introduction,SciSoftX Scientific Software Explorer,Conclusion
Latex_files/full/expanded/160607356.tex,Introduction,Related Work,Behavior Analyses,Conclusion
Latex_files/full/expanded/170301041.tex,Introduction,Related Work,Methods,Experiments and Results,Analysis,Conclusion,Methods Details,FLOPs estimation,Escaping Local Optima Details
Latex_files/full/expanded/190500568.tex,Introduction,Related Work,Methods,Experiments,Discussion,Conclusion,Acknowledgement
Latex_files/full/expanded/200913650.tex,Introduction,Challenges of Defining Fairness,Background,Prediction Sensitivity,Applying Prediction Sensitivity,Empirical Evaluation,Discussion  Future Work,Related Work,Conclusion
Latex_files/full/expanded/211012172.tex,Introduction,Related Work,Method,Experimental Evaluation,Discussion,Conclusion
Latex_files/full/expanded/191013799.tex,Introduction,Related Work,Our Approach,Experiments,Conclusion
Latex_files/full/expanded/210810908.tex,Introduction,Background,Proposed Anomaly Detection Methodology,Experiments,Conclusion,Conclusions
Latex_files/full/expanded/201209624.tex,Introduction,Related Work,Preliminaries,Our Proposed Model,Experiments,Conclusion
Latex_files/full/expanded/210412086.tex,Introduction,Related Work,FedSup Design,Evaluation Results,Conclusion
Latex_files/full/expanded/190602635.tex,Introduction,Related Work,The Model,Supermarket Application,Identification and Placebo Tests,Assessing Model Performance and Fit,Conclusion,Appendix
Latex_files/full/expanded/210305154.tex,Introduction,Need for Explanations,Regulations Standards and Stakeholders,Explanation Categorisations,Explainable Autonomous Driving Operations,System Management,Challenges and Future Research Directions,Conclusion
Latex_files/full/expanded/191102833.tex,Introduction,Background,Proposed Algorithm,Results and Discussion,Conclusion
Latex_files/full/expanded/14106142.tex,Introduction,Background
Latex_files/full/expanded/200803507.tex,Introduction,textitJukeBox Dataset,Datasets and Experimental Protocols,Results and Analysis,Summary,Acknowledgements
Latex_files/full/expanded/170108305.tex,Introduction,Mathematical Preliminaries,Approximate textbfMinMax Aggregation,Simulations
Latex_files/full/expanded/13090242.tex,Introduction,Community detection,Ensemble methods,Simulation experiments,Concluding remarks
Latex_files/full/expanded/210603143.tex,Introduction,Related Works,Theoretical Analysis of Absolute Sinusoidal Positional Embeddings,Continuous Augmented Positional Embeddings CAPE,Experiments,Automatic Speech Recognition Experiments,Machine Translation,Discussion and Conclusion,Acknowledgments,CAPE Implementation in Python,Image Recognition Experiments
Latex_files/full/expanded/200104061.tex,INTRODUCTION,RELATED WORK,Oxford Inertial Odometry Dataset,Inertial Navigation Models,Experiments,Conclusions and Future Work
Latex_files/full/expanded/180709236.tex,Introduction,Choice Models,BiasVariance Tradeoffs in MNL Estimation,Estimating Sigma A and u,Experiments,Conclusion,Appendix Efficiently  estimating gamma with priors
Latex_files/full/expanded/191111775.tex,Introduction,Related Work,Dataset,Models,Evaluation,Conclusions,Acknowledgements
Latex_files/full/expanded/211000181.tex,Introduction,Data Description,Methodology Description,Case Study,Conclusion and Future Work,ACKNOWLEDGMENTS
Latex_files/full/expanded/210310763.tex,Introduction,Related Work,The Approach,Experiment,DISCUSSION,Conclusion and Future Work
Latex_files/full/expanded/180803726.tex,Introduction,General Instructions,Translation of nonEnglish Terms,Length of Submission,Appendices,Supplemental Material
Latex_files/full/expanded/161108733.tex,Introduction ATP Strategy Invention,Proof Search Strategies,Blind Strategymaker BliStr,BliStrTune Hierarchical Invention,Experimental Evaluation,Conclusions and Future Work
Latex_files/full/expanded/210904877.tex,Introduction,Adapters for Crosslingual Transfer,Generalizing Language Adapters to Related Languageslabelsecgeneralizedadapters,Experimentslabelsecexp,Related Work,Discussion and Conclusion,Implementation Detailslabelapptrain,Decoding Speedlabelappdecodespeed,Examples of outputs
Latex_files/full/expanded/10090306.tex,Introduction,The Overlapping Group Lasso,The Associated Proximal Operator and Its EfficientComputation,Experiments,Conclusion
Latex_files/full/expanded/200400505.tex,Introduction,Related Work,Methods,Results,Conclusion
Latex_files/full/expanded/161202741.tex,Introduction,Approach,Experiments,Related Work and Discussions,Conclusion and Future Work
Latex_files/full/expanded/190911765.tex,Introduction,The Multimodal Alerting System,Conclusion  Future Work
Latex_files/full/expanded/190600709.tex,Introduction,Related work,Preliminaries,Proposed method,Experiments,Conclusion
Latex_files/full/expanded/210810061.tex,Introduction,Software Framework,Evaluation  Function,Conclusion  Future Work,
Latex_files/full/expanded/191100616.tex,Introduction,Concept and Basic Algorithm,Results,Conclusion
Latex_files/full/expanded/200612618.tex,Introduction,Methods,Simulation Studies,A Study of Adolescent Brain Connectivity Development,Conclusion
