Latex_files/full/expanded/201015549.tex,Introduction,MultiConstitutive Laws in Large Deformation Poromechanics,MultiConstitutive Neural Network,Results and Discussions,Conclusion
Latex_files/full/expanded/180505086.tex,Conclusions,Introduction,Related Work,benchmark A New Benchmark Dataset,Results and Discussion
Latex_files/full/expanded/200107135.tex,Introduction,Background,Framework,Theory,Related Work,Experiments,Conclusion
Latex_files/full/expanded/210803452.tex,Introduction,Background,Neglect in AlphaStar,Defects of AlphaStar,Related Works,Future Ways,Conclusion,More Information of AS,Experiments of RA vs HA,Neglect in AS More Cases,Defects of AS More Cases,Scouting in AS,Description of All Replays,Analysis of All Replays
Latex_files/full/expanded/210906692.tex,Introduction,Related work,Dataset,Experiments,Conclusion,Acknowledgements
Latex_files/full/expanded/180611015.tex,Introduction,Preliminaries on Gaussian Bayesian networks,Structure learning with the PC algorithm,Blackbox Bayesian optimization,Numerical experiments,Conclusions and future work
Latex_files/full/expanded/14076067.tex,Introduction,The procUCurve and the procUCurveSearch  algorithms,Experimental Results,Discussion,Conclusion,Acknowledgments
Latex_files/full/expanded/170703908.tex,Introduction,Related Work,Mappy,Cleaning Up,Discussion
Latex_files/full/expanded/200400773.tex,Introduction,Related Work,The Proposed Framework,Discussion,Experimental,Conclusion,Acknowledgement
Latex_files/full/expanded/200106057.tex,Introduction,Related work,Methods,Results,Discussion  Conclusion,Acknowledgements
Latex_files/full/expanded/180607524.tex,Introduction,Background,Linking Publications to Unique Author Profiles,Completing Temporal Affiliation Information using MAG,Selecting Reliable Author Profiles,Characteristics of Data sets,Conclusion and Future Work
Latex_files/full/expanded/9120224.tex,Introduction,Previous and Related Work,A Multistage Probabilistic Algorithm,Experiments and Results,Conclusions
Latex_files/full/expanded/180801128.tex,Introduction,Data,Methods,Training,Results,Conclusion
Latex_files/full/expanded/200202427.tex,Motivations,Data,Monolingual Irony Detection,Crosslingual Irony Detection,Discussions and Conclusion
Latex_files/full/expanded/210612930.tex,Introduction,Proposed Method,Experiments and Results,Discussion,Conclusions
Latex_files/full/expanded/210701248.tex,Introduction,Related Work,Uncertainty in Fingerprint Preprocessing,Estimating Data Uncertainty,Databases,Training and Testing,Evaluation Metrics,Results and Discussions,Conclusion and Future Work
Latex_files/full/expanded/210602533.tex,Introduction,Survey Methodology,Graphbased Deep Learning Introduction,Wireless Networks,Wired Networks,Software Defined Networks,Future Directions,Conclusion
Latex_files/full/expanded/201206723.tex,Introduction,Related Work,Methodology,Experiments and Results,Conclusion
Latex_files/full/expanded/201003124.tex,Introduction,Related Work,Proposed Approach,Empirical Study,Results,Conclusion
Latex_files/full/expanded/210708687.tex,INTRODUCTION,RELATED WORK,BACKGROUND Time series and forecasting,METHODOLOGY,EXPERIMENTS,BUSINESS PROCESSES
Latex_files/full/expanded/200111767.tex,Background,Methods,Results,Discussion
Latex_files/full/expanded/200801389.tex,Introduction,Background,ClassIncremental Domain Adaptation,Experiments,Conclusion
Latex_files/full/expanded/211106266.tex,Introduction,Related work,AlphaDDA,Experimental settings,Results,Conclusion and discussion,AlphaZero,Monte Carlo tree search,Minimax algorithm,Elo rating
Latex_files/full/expanded/180101586.tex,Introduction,Autoencoder essentials,Autoencoders for feature fusion,Comparison to other feature fusion techniques,Applications in feature learning and beyond,Guidelines software and examples on autoencoder design,Conclusions,Description of used datasets
Latex_files/full/expanded/210212439.tex,Introduction,Results,Discussion,Methods,Data availability,Acknowledgements,Author contributions,Competing interests,The generative model,Supplementary results
Latex_files/full/expanded/181210775.tex,Introduction,Related Work,Method,Experiments,Conclusion,Semisupervised Classification,Part Segmentation,Part Interpolation,Part Replacement,Ablation Study,A Discussion on the Local Spatial Attention
Latex_files/full/expanded/8034074.tex,Introduction,Method,Experiment,Conclusion
Latex_files/full/expanded/210212178.tex,Introduction,Related Work,Learning Wasserstein barycenters,Experimental Results,Discussion and conclusion,Learning Strategy,Additional results,Linearized barycenters
Latex_files/full/expanded/180110308.tex,Introduction,Related Work,Nested LSTMs,Experiments,Conclusions
Latex_files/full/expanded/200907738.tex,Introduction,Background,Problem Formulation,Proposed Method,Experiments,Conclusion,Appendix
Latex_files/full/expanded/210914545.tex,Introduction,Evolution of Activation Functions,Logistic Sigmoid and Tanh Based AFs,Rectified Activation Functions,Exponential Activation Functions,LearningAdaptive Activation Functions,Miscellaneous Activation Functions,Aspects of Activation Functions,Performance Comparison and Analysis,Conclusion and Recommendations
Latex_files/full/expanded/191007056.tex,Introduction,Diagonal metric selection,Evaluation of scaled proximal mapping,Experiments,Conclusion,Proofs and Derivations,Additional Results
Latex_files/full/expanded/170904049.tex,Proofs,Expert Algorithms
Latex_files/full/expanded/12043838.tex,Introduction,Fourdimentional HindmarshRose model energy,Synchronization energy of two electrically coupled neurons
Latex_files/full/expanded/211000459.tex,Introduction,Background,Workload Design and Characterization,Characterizing Application Concurrency Mechanisms,Discussion,Related Work,Conclusions
Latex_files/full/expanded/210612692.tex,Introduction,Background,Method,Evaluations and Discussion,Conclusion and Future Work
Latex_files/full/expanded/200513630.tex,Introduction,Method and Architecture,Theoretical Motivation of emphClaDec,Assessing Interpretability and Fidelity,Evaluation,Related Work,Conclusions
Latex_files/full/expanded/200610029.tex,Introduction,Method,Empirical Study,Related work,Discussion,Broader Impact,When Do Bigger Models Help More,Parameter Efficiency Also Matters,The Correlation Between Linear Evaluation and Finetuning,The Impact of Memory,The Impact of Projection Head Under Different Model Sizes,Further Distillation Ablations,Extra Results
Latex_files/full/expanded/191205179.tex,Introduction,Tensor completion,Initialization,Experimental results,Related works,Conclusions
Latex_files/full/expanded/180606796.tex,Introduction,Related Work,name Focusing on search and user interface ,Conclusions
Latex_files/full/expanded/210610700.tex,Introduction,Material and methods,Results and discussion,Conclusion,List of Supervised Classifiers,Results obtained from the evaluation of each research feature
Latex_files/full/expanded/201212477.tex,Introduction,Incremental ImplicitlyRefined Classification IIRC,Related Work,Benchmark,Baselines,Experiments,Conclusion,Models Hyperparameter Details,Baselines Details,IIRC Dataset Statistics,More Figures,Effect of Buffer,Pseudo Codes,IIRC Datasets Hierarchies,Results in Tables
Latex_files/full/expanded/210806846.tex,Introduction,Proportionatetype NLMS Algorithms,Conclusion,Properties of PtNLMS algorithms,Simulations
Latex_files/full/expanded/12014089.tex,Basic Building Blocks of DL Ontologies,Constructors for Concepts and Roles,The Description Logic SROIQ,Description Logic Semantics,Important Fragments of SROIQ,Relationship to OWL,Further Reading
Latex_files/full/expanded/201005352.tex,Introduction,Related Work,Methods,Experiments,Conclusion,Supplementary Details for the MoCoCXR Method,Supplementary Details for MoCoCXR Performance,MoCoCXR Performance on Other CheXpert Tasks
Latex_files/full/expanded/201008146.tex,Related Work,Problem Definition,Vanilla Hoeffding Tree,The Fair Splitting Criteria,Online Fairnessaware Decision Tree Growth Algorithms,Experiments,Conclusion,Introduction
Latex_files/full/expanded/200207956.tex,Introduction,Background,Related Work,Motivation,Method,Results,Conclusion
Latex_files/full/expanded/190205394.tex,Introduction,Preliminary,On radar signal annotation using  a coupled camera,On Signal Preprocessing and FCN Training,Experiments,Conclusions
Latex_files/full/expanded/171101343.tex,Introduction,Sparsity,Edge Processing and Interleaving,Results,Conclusion and Future Work
Latex_files/full/expanded/201004617.tex,Introduction,Related Work,The Issues of Momentum and Adaptive Methods on Manifolds,Adaptive Methods Through Trivializations,Experiment SetUp and Hyperparameters,Experiments,Conclusion and Future Work,Review of Vector Bundles and Connections,Topological obstructions to admitting a connection with trivial holonomy
Latex_files/full/expanded/211002344.tex,Introduction,Related Work,Problem Formulation,Approach,Experimental Results,Conclusion,Additional Experiment Details,Additional Model Details,Additional Qualitative Examples
Latex_files/full/expanded/201205715.tex,Introduction and Motivation,What is coinduction Informally,Natural language processing is intuitively coinductive,NL understanding coinduction and induction together,Not everything should be done via coinduction,Discussion and summary
Latex_files/full/expanded/210911978.tex,Introduction,Massively Parallel Reinforcement Learning,Task Description,Results,Conclusion,Appendix
Latex_files/full/expanded/180309866.tex,Introduction,Empowerment,Empowerment,Empowerment with UCT Tree Search,Evaluation,conclusion
Latex_files/full/expanded/12082925.tex,Introduction,Overview of the approach,Constraint Based Synthesis,The hybrid approach,Experiments,Related Work,Conclusions
Latex_files/full/expanded/191100490.tex,Introduction,Methodology,Experiment,Results,Breakdown of the Work
Latex_files/full/expanded/181209975.tex,Introduction,The Data Center as RL Environment,Emulator Design,Preliminary Experiments,Concluding Remarks,Appendix
Latex_files/full/expanded/211010369.tex,Supplementary materials,Introduction,Related works,Model composition strategy,Experiment results and discussions,Conclusion
Latex_files/full/expanded/181000671.tex,Introduction,General Instructions, Do not include this section when submitting your paper for review,Supplemental Material,Multiple Appendices
Latex_files/full/expanded/190203642.tex,Introduction,Background,qpWasserstein GAN,Comparison of pWasserstein Metrics,Experiments,Conclusion
Latex_files/full/expanded/160306485.tex,Introduction,System Description,Application of the System in the Social Science Domain,Conclusion
Latex_files/full/expanded/211104330.tex,Introduction,Upstreamdownstream paradigm,Adversarial attack for speech SSL,Experiment,conclusion
Latex_files/full/expanded/200907943.tex,Introduction,Background and related work,Experimental design,Overview of experiments,Experiment 4 Addition of trend line features,Summary of the best performing trend prediction algorithms,Discussion and Conclusions,Appendices
Latex_files/full/expanded/161105722.tex,Introduction,Related work,GENetic Extraction of a Single Interpretable Model textscgenesim,Results and evaluation,Conclusion
Latex_files/full/expanded/8022015.tex,Introduction,Expert Sequence Priors,Expert Tracking using HMMs,Zoology,New Models to Switch between Experts,Extensions,Conclusion
Latex_files/full/expanded/210615127.tex,Introduction,Background,Evolving Graphs using Gaussian Processes,Experimental results,Conclusion,Analysis of eGGP,Supplementary training details,Supplementary results
Latex_files/full/expanded/161100448.tex,Introduction,NaturalParameter Networks,Variants of NPN,Experiments,Details on Variants of NPN,Derivation of Gradients,Conclusion,Proof of Theorem refthmoment,ExponentialFamily Distributions and Activation Functions,Mapping Function for Poisson Distributions,AUC for Link Prediction and Different Data Splitting,Hyperparameters and Preprocessing
Latex_files/full/expanded/210315950.tex,Introduction,Related Work,Proposed Approach,Evaluation,General Discussion,Conclusion
Latex_files/full/expanded/210801234.tex,Introduction
Latex_files/full/expanded/201210467.tex,Introduction,Related Work,Minimax Active Learning,Experiments,Ablation study,Conclusion,Datasets Statistics
Latex_files/full/expanded/171205134.tex,Introduction,Related Work,Tensorizing Recurrent Neural Networks,Experiments,Conclusion
Latex_files/full/expanded/201203458.tex,Introduction,Additionasint as float multiplication,Experimental settings,Results,Conclusion and discussion
Latex_files/full/expanded/180405044.tex,Introduction,Related Work,Preliminaries,Activity Workflow Model and Instance Ontology,Operational Semantics,Evaluation,Conclusion
Latex_files/full/expanded/191005811.tex,INTRODUCTION,PRELIMINARIES,AdaWISH ADAPTIVE DISCRETE INTEGRATION,EXPERIMENTS,CONCLUSION,ACKNOWLEDGEMENTS,SUPPLEMENTARY MATERIAL
Latex_files/full/expanded/200400001.tex,Introduction,Dataset,Proposed System,Experiments,Conclusion,Acknowledgements
Latex_files/full/expanded/191109218.tex,Introduction,Related Work,Notation  Definition,Proposed Method,Experiments,Conclusion
Latex_files/full/expanded/210300906.tex,Introduction,Related Work,Problem Formulation,Method,Experiments,Conclusion
Latex_files/full/expanded/181204513.tex,Introduction,Methods,Results,Discussion
Latex_files/full/expanded/160403034.tex,Introduction,Scaling Up using proj,Experiments,Conclusions  Ongoing Work,Acknowledgments
Latex_files/full/expanded/210812641.tex,Introduction,Related Work,Problem Formulation,Continual Learning with Prototypesguided Memory Replay,Experiments,Conclusion,Additional Experiments
Latex_files/full/expanded/201008625.tex
Latex_files/full/expanded/210204481.tex,Introduction,Definitions and concepts,Bayesian twopart hurdle QR,Simulation study,Citation count example,Discussion and conclusion,Acknowledgments,Author contributions,Competing interests,Funding information,Data availability
Latex_files/full/expanded/181207071.tex,Introduction,Feature Preparation,Learning Fuzzy Functions,Experiments,Conclusion and Future Work
Latex_files/full/expanded/160308358.tex,Introduction,Quadratic Optimization Formulation,Linear Systems for Efficient and Effective Structured Prediction,Experiments,Conclusions and Future Work
Latex_files/full/expanded/191107629.tex,Introduction,Description of Basic Idea and Model Architecture,Our Approach,Setup And Discussion,Conclusion
Latex_files/full/expanded/191111657.tex,Introduction,Materials  Methods,Experimental Results  Discussion,Conclusion and Future Work
Latex_files/full/expanded/170802059.tex,Introduction,Related works,Sparse logistic regression with weakly convex regularization,A proximal gradient method,A specific weakly convex function and iterative firmshrinkage method,Numerical experiments,Conclusion and future work
Latex_files/full/expanded/201006705.tex,Introduction,Related Work,Problem Definition,Model,Evaluation,Conclusion
Latex_files/full/expanded/181103866.tex,Introduction,Related Work,The FormContext Model,Experimental Setup,Evaluation,Analysis,Conclusion and Future Work
Latex_files/full/expanded/12102715.tex,The world of the TickTackToe game,A definition of AI
Latex_files/full/expanded/210106549.tex,Introduction,Related Work,Generating SafetyCritical Scenarios,Experiments,Conclusion,Implementation Details,Additional Experiments,Qualitative Examples
Latex_files/full/expanded/200713982.tex,Introduction,Performance Under Mixture Covariate Shift,Variational Approximation to WorstCase Loss,Tractable Risk Bounds for Lp Variational Problem,Proofs,Risk bounds under confounding,Experiments,Proofs
Latex_files/full/expanded/180507472.tex,Introduction,Modeling unforced dynamics,Modeling forced dynamics,Model predictive control,Related work,Conclusions
Latex_files/full/expanded/11096051.tex,Introduction,Related Work,Fast Downward,MultiValued Planning Tasks,Knowledge Compilation,Search,Experiments,Summary and Discussion
Latex_files/full/expanded/190603671.tex,Introduction,Notation and setting,Algorithm,Experiments,Related work,Discussion,The kmeansp seeding algorithm,ouralg for binary logistic regression,All learning curves,Pairwise comparisons of algorithms,CDFs of normalized errors of different algorithms,Batch uncertainty and diversity,Comparison of kmeansp and kDPP in batch selection
Latex_files/full/expanded/190808026.tex,Introduction,Background,Approach,Study,Results,Conclusion
Latex_files/full/expanded/201000110.tex,Assessing Machine Learning Models,Pieces of the Metrics Puzzle,Metrics for Model Validation and Benchmarking,Metrics for Uncertainty Quantification,Concluding Remarks
Latex_files/full/expanded/200308820.tex,Introduction,Datasets description,Models,Results and Conclusions
Latex_files/full/expanded/210703564.tex,Introduction,Related Work,Method,Experiments,Conclusion
Latex_files/full/expanded/14067648.tex,Background and notations,Constraintbased structure learning and backtracking,A framework for parallel constraintbased learning,Discussion and conclusions
Latex_files/full/expanded/191008322.tex,Introduction,Related work,Background the classic formulation of ANN search,ANN search as a multilabel classification problem,Model for ANN search defined as a classification problem,Interpretation of lookupbased search in the classification framework,Experiments,Discussion and future research directions
Latex_files/full/expanded/14114738.tex,Introduction,Related Work,Similarity Learning for Cross Modalities,Experiment,Conclusion,Acknowledgments
Latex_files/full/expanded/200602366.tex
Latex_files/full/expanded/200101056.tex,Introduction,Background and Related Works,Root Cause Detection Method,State Estimation,Simulation Study,Applications,Conclusions
Latex_files/full/expanded/201013080.tex,Introduction,Related Work,Problem Statement and Notations,Method,Experiment,Conclusion and Future work
Latex_files/full/expanded/161001925.tex,Metaheuristic algorithms,Convolution Neural Network,Design of proposed methods,Simulation and results,Conclusion
Latex_files/full/expanded/150802375.tex,Introduction,Dependency Parsing by Belief Propagation,Approximationaware Learning,Other Learning Settings,Experiments,Discussion,Conclusions
Latex_files/full/expanded/181101287.tex,Introduction and Related Work,Model,Experiments,Qualitative analysis
Latex_files/full/expanded/201213574.tex,Introduction,Flushing Techniques,Planning and Optimization methods,Discussion and Summary
Latex_files/full/expanded/161006447.tex,Introduction,Theoretical Preliminaries,Mathematical Formulation,Algorithmic Derivations,Classical Regularizers and Divergences,Experimental Results,Conclusion
Latex_files/full/expanded/200901048.tex,INTRODUCTION,Related Work,Problem Formulation,Adversarial Comments Generation,Evaluation,Discussion,Limitations and Future Work,Conclusion
Latex_files/full/expanded/201015289.tex,Introduction,Reservoir Computing Methodology for Network Inference,Discussion,Acknowledgements,Optoelectronic Oscillator Networks,Results of Link Inference Tests
Latex_files/full/expanded/200308561.tex,Introduction,Proposed Model,Related Work,Experimental Result,Analysis of TaskAdaptive Representation,Conclusions
Latex_files/full/expanded/210711412.tex,Introduction,Preliminaries,Experiments and Analysis,Results and Discussions,Conclusion
Latex_files/full/expanded/210606261.tex,Introduction,Method,Results,Discussion
Latex_files/full/expanded/10080659.tex,Introduction,Background,Overview of variable ordering heuristics,Experiments and results,Conflictdriven revision ordering heuristics,Conclusions and future work
Latex_files/full/expanded/200209927.tex,Introduction,Related work,Importance sampling for BO,Experiments,Conclusion,Feedforward Neural Network on MNIST,IBO scales with dataset and network complexity,Initializing Fabolas
Latex_files/full/expanded/211103664.tex,Introduction,Related work,KD with Oracle Teacher,Experimental settings,Experimental results,Conclusions
Latex_files/full/expanded/210411070.tex,Introduction,Approach,Experimental Setup,Results and Discussion,Conclusions
Latex_files/full/expanded/200812190.tex,Appendix Another Error correction Scheme
Latex_files/full/expanded/14044038.tex,Introduction,Our Approach,Related Work,Experiments,Summary and Future Work
Latex_files/full/expanded/180604168.tex,Introduction,Syntactic Distances of a Parse Tree,Learning Syntactic Distances,Experiments,Related Work,Conclusion
Latex_files/full/expanded/191009311.tex,Introduction,State of the Art,Classic approach,Time Lines,Time unfolding,Results
Latex_files/full/expanded/190409483.tex,Introduction,Related Work,CleanML Database Schema,CleanML Database Instance,Analyzing CleanML Database,Overall Observations for Single Error Types,Mixed Errors RobustML and Human Cleaning,Future Research,Acknowledgement
Latex_files/full/expanded/210211274.tex,Introduction,Problem Formulation,Federated Learning  with Intermittent Resource Arrivals,Convergence Analysis,Experiments,Conclusion
Latex_files/full/expanded/180608156.tex,PRELIMINARIES,IDENTIFIABILITY,GREEDY SEARCH,Discussion
Latex_files/full/expanded/161209205.tex,Introduction,Methods,Experiments,Conclusion
Latex_files/full/expanded/160702078.tex,Introduction,Related Work,Approach,Experiment Setup,Results,Discussion
Latex_files/full/expanded/210206665.tex,Introduction,Methods,Numerical Results,Conclusion,Appendix
Latex_files/full/expanded/201111600.tex,Introduction and Related Work,Problem Description and Design Considerations,Method,Evaluation,Results,Conclusion and Future Work,Acknowledgments
Latex_files/full/expanded/210812768.tex,Introduction,Methods,Benchmark Results and Dataset Observations,Related Work,Conclusions
Latex_files/full/expanded/200900735.tex,Introduction,Computational methods,Results,Discussion,Summary,Data and source code availability,Computational methods,Additional results
Latex_files/full/expanded/200801003.tex,Introduction,Related Work,Methods,Experiments,Conclusion
Latex_files/full/expanded/210911929.tex,Conclusion and Future Work,Introduction,Related Work,Preliminary Knowledge,Our proposed model,Experiments
Latex_files/full/expanded/200512064.tex,Introduction,Discrete Configuration Space Model,Combinatorics of the Trajectory Space,Conclusion
Latex_files/full/expanded/210612758.tex,
Latex_files/full/expanded/210400362.tex,Introduction,Background,Related Work,Evaluation Framework,Evaluation of Existing Approaches on Small Event Logs,Future Work
Latex_files/full/expanded/210605335.tex,Introduction,Preliminaries,A Posterior Sampling RL Algorithm for SSP Models,Theoretical Analysis,Experiments,Proofs
Latex_files/full/expanded/210308255.tex,INTRODUCTION,Related Work,Background,CCFDM Implementation,Experiment and result,Conclusion
Latex_files/full/expanded/12065135.tex,Introduction,Knowledgeblog,Representing Mathematics,Representing References,Discussion,Conclusion
Latex_files/full/expanded/210607361.tex,Tests description,Results,Conclusion and future work,Acknowledgments,Appendix,Notation,Introduction,Problem formulation,A novel twostep probabilistic approach
Latex_files/full/expanded/150700210.tex,Introduction,The Natural Gradient,Experiments,Discussion,Projected Natural Gradient Descent
Latex_files/full/expanded/200704921.tex,Introduction,Related Work,Method,Experiment,Conclusion,Conflicts of interest,Acknowledgements,Supplementary Information
Latex_files/full/expanded/190712253.tex,Introduction,Related Work,Point Clouds from a Single RGB Image,Reconstruction of Occluded Objects,Experiments,Conclusion,Reconstruction Performance with Silhouette Guidance on ShapeNet
Latex_files/full/expanded/210613869.tex,Introduction,Materials and Methods,Results and Discussions,Conclusion
Latex_files/full/expanded/12107559.tex,Introduction,Preliminaries,Tensor Structure in Latent Variable Models,Orthogonal Tensor Decompositions,Tensor Power Method,Discussion,FixedPoint and Variational Characterizations of Orthogonal TensorDecompositions,Analysis of Robust Power Method,Variant of Robust Power Method that uses a Stopping Condition,Simultaneous Diagonalization for Tensor Decomposition
Latex_files/full/expanded/180308375.tex,Introduction,Methodology,Experiments,Conclusion and Recommendation,Acknowledgment
Latex_files/full/expanded/190312571.tex,Introduction,Background,Materials and Methods,Results,Discussion and Conclusions
Latex_files/full/expanded/190102402.tex,Introduction,Contamination attack,Datasets preprocessing  models ,Contamination attack experiments,Defenses,Conclusion,Additional textscAdult dataset experiments,Alternative mitigation strategies,Lemmareflemmasubvar proof
Latex_files/full/expanded/190109135.tex,Introduction,Related Work,Method,Experiments and Discussion,Conclusions and Future Work
Latex_files/full/expanded/191003973.tex,Introduction,Related Works,Learning Contact Event Detection and Predicting ,Data Collection,Experiments,Conclusion and Discussion
Latex_files/full/expanded/191206721.tex,Introduction,Approach,Results,Conclusion
Latex_files/full/expanded/171007783.tex,Introduction,SSAG algorithm,Related Work,General convergent result of gradient descent,Convergence and Complexity Analysis of SSAG,Experiment results,Further Discussion,Conclusion
Latex_files/full/expanded/210900430.tex,Introduction,Related Work,The protectOurResources Dataset,The protectOurResources Benchmarks,Evaluating the protectOurResources benchmarks against the protectOurResources dataset,Conclusion and Future Work,Appendix
Latex_files/full/expanded/191111881.tex,Introduction,Related work,Methodology,Experiments,Discussion
Latex_files/full/expanded/211104190.tex,Introduction,Related Work,Problem Formulation,vizai Framework,Datasets,Crowd Sourcing Framework,Experimental Results,Conclusions
Latex_files/full/expanded/210208945.tex,Introduction,Related Work,Method,Experimental Evaluation,Conclusion,Appendix
