Latex_files/full/expanded/211010555.tex,Introduction,Related Work,Background on Ontology Embeddings,Proposed Approach,Experiments,Results,Conclusion
Latex_files/full/expanded/191102014.tex,Introduction,Methods,Experiments,Conclusion
Latex_files/full/expanded/161105397.tex,Related Work,Background,Auxiliary Tasks for Reinforcement Learning,Experiments,Conclusion,Atari Games,Implementation Details,Labyrinth Levels
Latex_files/full/expanded/191100417.tex,Introduction,spectrotemporal measures of novelty,Application to avian bioacoustics,Application to marine bioacoustics,Conclusion,Acknowledgment
Latex_files/full/expanded/190408082.tex,Introduction,Related Work,Proposed Method,Experiments,Analysis,Conclusion
Latex_files/full/expanded/190401186.tex,Introduction,Related Works,Datafree Student Network learning,Experiments,Conclusion
Latex_files/full/expanded/190309328.tex,Introduction,Related Work,Methods,Experiments and Results,Discussion and Conclusion, Acknowledgments
Latex_files/full/expanded/191105702.tex,Introduction,Related Work,Data Collection,Daily Predictions for Crowdfunding Outcomes,Results,Retrospective Mining of Patterns in TimeVarying  Features,Conclusion
Latex_files/full/expanded/191202989.tex,Introduction,General Idea and Analysis,Main Models and Guiding Methods,Concrete Analysis,Policy Design,Robustness and Regional Validation,Assessment of Our Models,Conclusion
Latex_files/full/expanded/180600770.tex
Latex_files/full/expanded/190510949.tex,Introduction,Related Work,QuesNet Modeling and Pretraining,Experiments,Conclusion
Latex_files/full/expanded/201105543.tex,Introduction,Related Work,Methods and Materials,Results,Conclusions
Latex_files/full/expanded/190308889.tex,Introduction,Related Work,Feature Learning Framework,Experimental Setup,Experimental Results,Conclusions
Latex_files/full/expanded/180507473.tex,Introduction,Related Work,Approach,Experiments,Conclusion
Latex_files/full/expanded/210507944.tex,Introduction,Related Work,Preliminaries,Proposed Method,Experiments,Conclusion,Reproducibility Supplement
Latex_files/full/expanded/210305293.tex,INTRODUCTION,Preliminaries,DRLbased Approach design,Experimental Evaluation,CONCLUSIONS
Latex_files/full/expanded/190901954.tex,Introduction,Proposed Method,Experimental Results,Conclusion and Future Directions
Latex_files/full/expanded/201212896.tex,Introduction,Theoretical Framework,Experiments on Graph Neural Networks,Experiments on Vision Datasets,Concluding Remarks,Additional Experimental Results,Experimental Details,Theoretical Results
Latex_files/full/expanded/201014104.tex,Introduction,Related Work,Problem formulation,Proposed method,Evaluation,Conclusion
Latex_files/full/expanded/210514149.tex,Introduction,Related Work,Background,Our Approach,Experimental Evaluation,Conclusion
Latex_files/full/expanded/200107394.tex,INTRODUCTION,RELATED WORK,PRELIMINARIES,AUTOMATIC DOMAIN SELECTION  DIMENSIONALITY REDUCTION ,SIMULATIONS AND EXPERIMENTS,CONCLUSION
Latex_files/full/expanded/161104416.tex,Introduction,Numerical approximation schemes forFFEP,Experiments,Discussion
Latex_files/full/expanded/200604164.tex,Introduction,Related Work,Problem Definition,Neighbor Sampling,Singlelayer GCN,Experiments,Conclusion
Latex_files/full/expanded/180810105.tex,Motivation,OWLAx Description and Main Functionalities,Implementation Information and Other Features
Latex_files/full/expanded/200615479.tex,Related Works,Targeted Problem and Proposed Model,Training Strategies,Experiments,Conclusion,Introduction
Latex_files/full/expanded/190603590.tex,Introduction,The ROA of a General Dynamical System,GP for Learning Unknown Dynamics,Conclusions and Future Work,Main Results,Numerical Simulations
Latex_files/full/expanded/14073685.tex,Introduction,Background,Finding the KMotif Sets,Data,Synthetic Data Results,Electricityusage Data,Conclusion
Latex_files/full/expanded/211004064.tex,Introduction,Related Work,Approach,Experiment and Results,Conclusion
Latex_files/full/expanded/200906345.tex,Introduction,Overview of data fusion and energy efficiency,Data fusion for appliance identification,Open challenges and future research orientations,Conclusion
Latex_files/full/expanded/210316435.tex,Introduction  Background,System Design and Implementation,Usage Scenarios,Ongoing Work  Conclusion
Latex_files/full/expanded/161001733.tex,Introduction,Related Work,Implementation of deep reinforcement learning,Experiments And Results,Conclusion
Latex_files/full/expanded/190512126.tex,Introduction,Methods,Experimental Setup,Results,Related Work,Conclusion,Acknowledgments,Hyperparameter Grid and Best Hyperparameters
Latex_files/full/expanded/14126563.tex,Results,Conclusions  Future Work,Introduction,Methods,Related work,Experiments
Latex_files/full/expanded/210411981.tex,Introduction,Formatting your paper,Final copy
Latex_files/full/expanded/201201953.tex,Introduction,Related Work,Drug and Disease Annotations,Drug and Disease Representational Models,Drugs4Covid Knowledge Graph,Use Cases,Lessons Learned and Future Work
Latex_files/full/expanded/191210103.tex,Background and Previous Works,TentacleNet,Experimental results,Conclusions,Introduction
Latex_files/full/expanded/201102917.tex,Introduction,Background Guessing Games and Concept Representations,Imagination Module Learning Context and Categoryaware Object Representations,Experimental Investigation,Related Work,Conclusions,Appendix
Latex_files/full/expanded/161104969.tex,Introduction,Answer Set Programming,Debugging Approach,The dwasp System,Related Work,Conclusion
Latex_files/full/expanded/180902637.tex,Introduction,Model,Experimental Setup and Results,Related Work,Conclusion and Future Work,Acknowledgements
Latex_files/full/expanded/180708430.tex,Introduction,Related work,The proposed approach,Experiments,Conclusion
Latex_files/full/expanded/191203264.tex,Introduction,Related Work,Methodology,Experiments,Conclusion
Latex_files/full/expanded/211004280.tex,Introduction,Related Works,Pyxis Dataset,Potential Applications,Conclusion and Future Work
Latex_files/full/expanded/160707326.tex,Introduction,Related Work,Proposed Approach,Experiments,Conclusions
Latex_files/full/expanded/13125242.tex,Introduction,Learning algorithm,Experiments,Discussion
Latex_files/full/expanded/190808873.tex
Latex_files/full/expanded/210407819.tex,Introduction,Related Work,Data,Method,Experiments,Discussion,Conclusion
Latex_files/full/expanded/201009474.tex,Introduction,Background,Methods and Technical Solutions ,Empirical Evaluation,Related Works,Conclusions,Acknowledgment
Latex_files/full/expanded/190707807.tex
Latex_files/full/expanded/201215863.tex
Latex_files/full/expanded/210408441.tex,Introduction,Related Work,Background,Proposed Approach,Evaluation Domain,Experimental Setup,Results and Discussion,Conclusions and Future Work
Latex_files/full/expanded/181109920.tex,A BRIEF INTRODUCTION OF THE UIC MODEL  FROM SHANNONS PERSPECTIVE,A BRIEF REVIEW OF THE SHANNON MODEL,COMPLEX INTERACTIONS MODELING IS SHANNON MODEL SUFFICIENT,THE AGENT MODEL IN THE UIC MODEL,MODELLING THE INFORMATION SOURCE AND DESTINATION IN THE AGENT,A BRIEF REVIEW OF THE AGENT INTERNAL MODELS,RETHINK THE LEARNING AGENT MODEL WITH AN INTERNAL WORLD MODEL,UNIFYING THE LEARNING AGENT MODELS,CONLUSIONS
Latex_files/full/expanded/171105225.tex,Introduction,CheXNet,Data,CheXNet vs Radiologist Performance,Model Interpretation,Related Work,Conclusion,Acknowledgements
Latex_files/full/expanded/200412817.tex,Introduction,TwoStage Distillation Framework,LightPAFF for BERT,LightPAFF for MASS,Further Analysis,Conclusion,Dataset,Tradeoff between Accuracy and Model Size,Analysis On the Use of Unlabeled Data,Analysis of lambda in Finetuning Distillation
Latex_files/full/expanded/181106146.tex,Introduction,Leastabsolutevalue Estimation,The Proxlinear Net,Deep RNNs for State Forecasting,Numerical Tests,Conclusions
Latex_files/full/expanded/190602912.tex,Introduction and Motivation,StateSpace Search,ExponentialBinary StateSpace Search,Experimental Results,Conclusions,Acknowledgements
Latex_files/full/expanded/210500249.tex,Introduction,Related work,Threat model,MK backdoor attack,Experimental methodology,Empirical results,Conclusion,Acknowledgements
Latex_files/full/expanded/180511450.tex
Latex_files/full/expanded/210307018.tex,Introduction,Related Works,Method,Experiments,Conclusions and Future Works
Latex_files/full/expanded/160105142.tex,Introduction,Related Work,Descendant Model,State Equivalency,Approach,Edge Cases,Descendant States,Archival Coverage,Storing Descendants,Conclusions,Acknowledgments
Latex_files/full/expanded/190604358.tex,Introduction,Related Work,Weight Agnostic Neural Network Search,Experimental Results,Discussion and Future Work,Supplementary Materials for Weight Agnostic Neural Networks
Latex_files/full/expanded/180602078.tex,Introduction,Convolutional Sequence to Sequence Model for Nonintrusive Load Monitoring,Experiments,Conclusion and Future Work
Latex_files/full/expanded/180906009.tex,Introduction,Approach,Experimental Results,Discussion,Conclusion
Latex_files/full/expanded/210905877.tex,Introduction,Preliminaries and Background,Our New Benchmark,Evaluation Plan,How Good Are The CE Methods,What Other Aspects of CE Methods Matter,Is Current Metric Good Enough,Conclusions and Future Work
Latex_files/full/expanded/200313058.tex,Proposed method,Highdimensional neural feature,Reduction of training cost,Results and discussion,Conclusion,Appendix
Latex_files/full/expanded/190905659.tex,Introduction,Methods,Experiments and results,Discussions and Conclusions
Latex_files/full/expanded/13126197.tex,Introduction,Review of dropout,Experimental setup,Weight scaling versus Monte Carlo or exact model averaging,Geometric mean versus arithmetic mean,Dropout ensembles versus untied weights,Dropout bagging versus dropout boosting,Conclusion
Latex_files/full/expanded/9030467.tex,Introduction,Formal background,Parameterized complexity,An example,Backdoors,Other examples,Bound consistency,Metaconstraints,Symmetry breaking,Approximate consistency,Other related work,Conclusions
Latex_files/full/expanded/200808416.tex,Introduction,Materials andMethods,Results,Conclusions andDiscussion
Latex_files/full/expanded/210306504.tex,Introduction,Background and Related Work,Approach,Evaluation,Discussion,Conclusion and Future Work
Latex_files/full/expanded/200507677.tex,Introduction,Background,Approach Fast Game Difficulty Adjustment through ITE,Results,Discussion and Conclusion
Latex_files/full/expanded/210106570.tex,Introduction,Background and Related Works,Our Approach,Experiments,Analysing the MI Attack on GNNs,Defense mechanisms,Conclusion
Latex_files/full/expanded/12073598.tex,Introduction,Method Learning to rank with a linear model,Results,Discussion and conclusion
Latex_files/full/expanded/13121031.tex,Introduction,DisDCA the practical updates versus the naive updates,Analysis of DisDCA for Orthogonal Data,Analysis of the Practical DisDCA in General Case,Conclusions and Open Problems
Latex_files/full/expanded/201006969.tex,Introduction,Related work,Dataset,Proposed solution,Experiment,Discussion and qualitative analysis,Conclusion
Latex_files/full/expanded/210307470.tex,Noise resampling,Interpolations between logits ,Interpolations between noise vectors ,Reconstructing Incorrectly Classified Images,Iterative Stability,Analysis of scale and shift effects,Training Details
Latex_files/full/expanded/190609926.tex,Introduction,Our Model,Related Work,Experiments,Conclusion
Latex_files/full/expanded/210410667.tex,Introduction,Related Work,WiFi Sensing of Occupants,Mapping WiFi APs to classrooms,Modeling classroom occupancy,Discussion,Conclusion
Latex_files/full/expanded/200913301.tex,,INTRODUCTION,LITERATURE REVIEW,PROBLEM DESCRIPTION,MODEL,RESOLUTION,COMPUTATIONAL STUDY,CONCLUDING REMARKS
Latex_files/full/expanded/181106588.tex,Introduction,Background,Infinitehorizon Gaussian processes,Experiments,Discussion and conclusion,Nomenclature,Forward derivatives for efficient log likelihood gradient evaluation,Stabilisation of the forward and backward gains,Classification examples,Electricity example
Latex_files/full/expanded/200711768.tex,Introduction,Related Work,Methods,Experimental Setup,Results and Observations,Conclusion
Latex_files/full/expanded/210404310.tex,Introduction,Background,ContextSelf Contrastive pretraining,Experiments,Results,Conclusion,CSCL implementation for reduced space complexity
Latex_files/full/expanded/181110097.tex,Introduction,Background,Experiments,Performance,Conclusion
Latex_files/full/expanded/201016253.tex,Introduction,Methods and Background,Result,Discussion,Conclusion,textbfClinical perspectives,Acknowledgment
Latex_files/full/expanded/181009409.tex,Introduction,Related Work,System Design,Wireless Sensing Platform,Event Classification,Memory Footprint Reduction Approach Time Distributed Processing,Result and Evaluation,Conclusion,Acknowledgement
Latex_files/full/expanded/200713475.tex,Introduction,Background,Problem Statement,Extending the HTTP ontology,Evaluation,Related Work,Conclusion,Appendix HTTP Interaction Ontology in Turtle
Latex_files/full/expanded/14041685.tex,Introduction,Legal Motivation,Logic  Background,Scenario Formalised,Conclusion
Latex_files/full/expanded/190511286.tex,Introduction,Related Work,Algorithm,Experiments,Conclusion
Latex_files/full/expanded/211003175.tex,Introduction,Background,Methodology,Experimentation,Conclusion,Experimental details,Experimental details on limitations of baseline,Additional experimental results
Latex_files/full/expanded/180609787.tex,Introduction,Proposed Framework,Current Progress,Future Work and Advices Sought,Acknowledgment
Latex_files/full/expanded/191112178.tex,Introduction,Problem Definition,Preliminaries,The Algorithm,Regret Analysis,System Identification via Random Inputs,Conclusions
Latex_files/full/expanded/210105272.tex,Introduction,Experimental Design,Methods,Results,Discussion
Latex_files/full/expanded/210203690.tex,Introduction,Related Work,Using Passive WiFi Sensing,Bayesian Sleep Inference,wisleeps System Overview,Experimental Evaluation,Practical Considerations,wisleeps Analytics,Discussion,Conclusions
Latex_files/full/expanded/201213838.tex,Introduction,Related Work,Method,Experiments,Conclusion,Proof of Variational Upper Bound,Visualization of the Effects of beta,Detailed Parameters and Dataset Information
Latex_files/full/expanded/160606434.tex,Motivation,Sensor Schema Editor,Sensor Schema Editor Implementation,Conclusions
Latex_files/full/expanded/161000768.tex,Introduction,Core functionalities,Reporting Benchmark Results,Versioning,Acknowledgments
Latex_files/full/expanded/180710680.tex,Experimental evaluation,Conclusion,Introduction,Latent truth discovery model,Generalized latent truth discovery
Latex_files/full/expanded/200413705.tex,Introduction,Background and Related Work,Analysis of Showing Your Work,Experiments,Conclusions,Cautionary Notes,Experimental Settings
Latex_files/full/expanded/190902027.tex,Introduction,Dataset,Benchmark Evaluation,Results,Prior Work,Conclusion
Latex_files/full/expanded/180505518.tex,Introduction,EventB formal developments,Need to embed ontologies in formal developments,Ontologies as theories,The OntoEventB plug In,Conclusion
Latex_files/full/expanded/170104143.tex,Introduction,Background,Threat Model,Attack Mechanism,Experimental Verification,Discussion on Current CounterMeasures,Conclusions and Future Work
Latex_files/full/expanded/190200179.tex,Introduction,CountSketch and Streaming Setting,Intuition,CountSketch Optimizers,Theoretical Analysis,Related Work,Experiments,Conclusion and Future Work,Appendix
Latex_files/full/expanded/210702466.tex,Introduction,Background and Problem Definition of Task Allocation with Task Importance,Datadriven Approach for Task Allocation,Performance evaluation,Case Study Chiller AIOps on the Edge,Related Work,Discussion,Conclusion
Latex_files/full/expanded/11100026.tex,Introduction,Examplecritiquing,Suggestions,Experimental Results Simulations,Experimental Results User Study,Related Work,Conclusion,Acknowledgements
Latex_files/full/expanded/191107456.tex
Latex_files/full/expanded/201009429.tex,Introduction,Granger Causality and the VAR Model,NAVAR Neural Additive Vector AutoRegression,Experiments,Related work,Discussion,Tuned Hyperparameters,ROC Curves
Latex_files/full/expanded/200307193.tex,Introduction,Term Weighting Schemes,Datasets,Experimental setup,Results,Conclusion and Future work
Latex_files/full/expanded/190210811.tex,Introduction,Potential Causes of Accuracy Drops,Summary of Our Experiments,Understanding the Impact of Data Cleaning on ImageNet,Discussion,Conclusion  Future Work,Related Work,Overview of the Appendix,Details of the ImageNet Experiments,List of ToDos
Latex_files/full/expanded/190407491.tex,Introduction,Rules and Features of Mahjong,Previous Research,Contributions,Outline of Proposed Method,Proposed Method,Experiments,Conclusion
Latex_files/full/expanded/181104115.tex,Introduction,Related Work,ADNet architecture,Experiments and Results,Conclusion
Latex_files/full/expanded/200704146.tex,Introduction,Approach,Related works,Experimental evaluation,Conclusion,Experimental Details,Datasets and task creation procedures,Further Experimental Results,Speeding up OCMAML
Latex_files/full/expanded/191006136.tex,Introduction,Mismatch in MachineLearning Enabled Systems,MLEnabled System Element Descriptors,Study Protocol,Summary and Next Steps
Latex_files/full/expanded/160800778.tex,Introduction,Exponential Family Embeddings,Empirical Study,Discussion,Inference,Stochastic Gradient Descent,Algorithm Details,Complements and Substitutes in the Shopping Data,Movie Rating Results
Latex_files/full/expanded/180300612.tex,Introduction,Related Work,Problem Overview,Relation Tail Entity Types Extraction,Model Architecture,Experiments,Conclusion
Latex_files/full/expanded/191205407.tex,Introduction,Related Work,Monte Carlo Tree Search with UCB,UCTADP Progressive Bias Algorithm,Experiments and Analysis,Conclusion and Outlook
Latex_files/full/expanded/181105932.tex,Introduction,Related Work,Experiments,Concluding Remarks,Problem Formulation,Methods
Latex_files/full/expanded/171003393.tex,Introduction,Escaping the TEGAR,Native Support for System Dynamics
Latex_files/full/expanded/200508177.tex,Introduction,Methodology,Results,NMT Syntax vs Other Models,Discussion,Conclusion
Latex_files/full/expanded/191109826.tex,Introduction,Related Works,Factorized Multimodal Transformer FMT Model,Experimental Methodology,Results and Discussion,Conclusion,Appendix
Latex_files/full/expanded/191104967.tex,Introduction,Data,Methods,Experiments and Results,Discussion,Conclusion,New or breakthrough work to be presented
Latex_files/full/expanded/151105432.tex,Introduction,Related Work,Robust Optimization,The Proposed Training Framework,Experimental Results,Conclusions
Latex_files/full/expanded/170509558.tex,Introduction,Bayesian GANs,Posterior Sampling with Stochastic Gradient HMC,Experiments,Discussion,Supplementary Material
Latex_files/full/expanded/191202109.tex,Introduction,Dataset and Methods,Results and Discussion
Latex_files/full/expanded/180902519.tex,Introduction,Background,Fair Causal Inference,Proposed Method,Related Work,Experiments,Discussion,Data Generation,Identifiability of Causal Effects,Experimental details
Latex_files/full/expanded/170310651.tex,Introduction,Counterfactual Models from Observational Traces,Experiments,Discussion,Equivalence of MPP Outcome Model and Counterfactual Model,Causal Bayesian Network,Simulation and Policy Details,Mixture Estimation Details
Latex_files/full/expanded/200712861.tex,Introduction,Related Work,METHODOLOGY,EXPERIMENTS,Conclusion
Latex_files/full/expanded/210309783.tex,,Introduction,Background,Methodology,Results,Threats to Validity,Conclusion
Latex_files/full/expanded/210612086.tex,Introduction,Background and Motivations,Federated Datadriven Multiobjective Optimization,Numerical Studies,Conclusions and future work
Latex_files/full/expanded/210206777.tex,Introduction,Related Work,Methodology,Experimental Setup,Experimental Results,Conclusion
Latex_files/full/expanded/201109608.tex,Introduction,Related Works,Methods,Experiments,Conclusion
Latex_files/full/expanded/190512100.tex
Latex_files/full/expanded/200404459.tex
Latex_files/full/expanded/180309820.tex,Introduction,Related work,The unreasonable effectiveness of validationtest loss,Cyclical learning rates batch sizes cyclical momentum and weight decay,Experiments with other architectures and datasets,Discussion,Appendix
Latex_files/full/expanded/180905814.tex
Latex_files/full/expanded/181103906.tex,Introduction,Related Work,Background,Constructive Operators,Stratified Reasoning,Global Constraints with ITE,Experimental Results,Conclusion
Latex_files/full/expanded/190911855.tex,Introduction,The proposed UGformer,Demonstration of UGformer,Conclusion
Latex_files/full/expanded/200104238.tex,Introduction,Nmbr9,Constraint programming model,Implementation,Conclusions
Latex_files/full/expanded/210607475.tex,Introduction,Related methods and techniques,Sanity Checks For Image vs Text ,Conclusion,Sanity Checks for Image,Sanity Checks for Text
Latex_files/full/expanded/191200958.tex,Introduction,Machine translation for Data Augmentation ,Results and Discussion,Conclusion
Latex_files/full/expanded/201007435.tex,Introduction,Materials and Methods,Results,Discussion,Related Work,Conclusion and future work,Supplemental Material Probing task performance, Supplemental Material Measuring model accuracy by meansquarederror
Latex_files/full/expanded/161205239.tex,Introduction,Related Work,Design and Development Process,The cendari Infrastructure,NoteTaking Environment,Data Integration and Semantic Services,Discussion,Conclusion,Acknowledgments,Pineapple  The Resource Browser
Latex_files/full/expanded/200908955.tex,Introduction,Background and Related Work,Neural Fair Collaborative Filtering,Experiments,Conclusion
Latex_files/full/expanded/180305044.tex,Introduction,Related Work,Reinforcement learning,Experiments,Conclusion,Learning to Explore
Latex_files/full/expanded/190706508.tex,Introduction,Methods,Results,Conclusion
Latex_files/full/expanded/190205946.tex,Introduction,Preliminaries,Revisiting Bayesian optimisation algorithms,Designing a modelbased BOA,Experiments and Results,Conclusions and future directions
Latex_files/full/expanded/190108456.tex,Introduction,Background,Methodology,Numerical Results,Discussion,Software Implementation  SIMON
Latex_files/full/expanded/191009716.tex,Introduction,Background and related work,Methods,Experiments and results,Further improvement,Conclusion,Triplet loss,Active learning selection criteria
Latex_files/full/expanded/180300590.tex
Latex_files/full/expanded/200905096.tex,Introduction,The Proposed Framework,Experimental Results,Conclusion
Latex_files/full/expanded/210201270.tex,Introduction,Related Work,Student Performance,Marmoset,Modelling Techniques,Features,Experiments and Evaluation,Conclusion and Future Work
Latex_files/full/expanded/210912872.tex,Introduction,Related Work,Vanilla Binary GNN and Preanalysis,Meta Neighborhood Aggregation,Experiments,Conclusions
Latex_files/full/expanded/201206462.tex,Introduction,Related work,Model and baseline,Experiments,Discussion
Latex_files/full/expanded/210300020.tex,Introduction and Motivating Work,Approach,Experiments,Comparison to Human Performance,Data Overlap Analysis,Limitations,Broader Impacts,Related Work,Conclusion,Linearprobe evaluation,ZeroShot Prediction,Duplicate Detector,Selected Task and Dataset Results,Model Hyperparameters
Latex_files/full/expanded/200800178.tex,Introduction,Background and Related Works,Contrastive Explanation Generation,Applications,Conclusion
Latex_files/full/expanded/210405522.tex,Sample Section Title,Sample Appendix Section
Latex_files/full/expanded/190907745.tex,INTRODUCTION,RELATED WORK,Method,EXPERIMENT,CONCLUSIONS,ACKNOWLEDGMENTS
Latex_files/full/expanded/200300827.tex,Introduction,Background and Related Work,Data,Methods,Experiments,Results,Summary and Discussion,Limitations and Future Work,Conclusion
Latex_files/full/expanded/160204498.tex,Introduction,Preliminaries,Motivation,Formalising the Algorithm,Evaluation,Conclusion and Future Work,Proof of creftheoremsoundness,Preliminaries Rewrite Systems,Proof of creftheoremcompleteness,Proof of crefpropcomplexity,Proof of crefpropworstcaseel
Latex_files/full/expanded/190207517.tex,Introduction,Related work,The NMLSDR method,Experiments,Case study,Conclusions and future work
Latex_files/full/expanded/190913428.tex,Introduction,Background,The DRIMSC model,Numerical experiment,Conclusion
Latex_files/full/expanded/210301353.tex,Introduction,Related Work,Technical Approach,Experimental Evaluation,Conclusions,Acknowledgments,MAVD Dataset,Extended Ablation Study,Evaluation of Audio Student Pretext Task,Evaluation in Low Illumination Conditions,Extended Qualitative Results
Latex_files/full/expanded/210913337.tex,Introduction,Related Work,Method,Experiments,Conclusion
Latex_files/full/expanded/201211154.tex,Introduction,Dataset Creation and Prediction Tasks,Dataset statistics,Evaluation Platform and Benchmark Results,Continued Work
Latex_files/full/expanded/211101166.tex,Introduction,Conclusion,Proof of the First Zonklar Equation,,Introduction
Latex_files/full/expanded/210703704.tex,Introduction,Related Work,Methodology,Results,Discussion  Conclusion
Latex_files/full/expanded/191201440.tex,Introduction,System Model,Optimal Control with Exact Distribution,Datadriven Distribution Estimator,Simulation Studies,Conclusion
Latex_files/full/expanded/190604027.tex,Introduction,Background,Audio Games in GVGAI,Experiments and Discussion,Conclusions
