Latex_files/full/expanded/200209303.tex,Introduction,Related Work,Dataset Description,Conclusion,Appendix Statistics,Appendix Word lists
Latex_files/full/expanded/191012993.tex,Introduction,Distribution Equivalence,Characterizing Equivalence,Graphical Characterization of Equivalence,Learning Directed Graphs from Data,Experiments,Conclusion,Proof of Proposition refpropdag,Proof of Proposition refproprot,Proof of Proposition refpropeffect,Proof of Proposition refpropdir,Proof of Proposition refpropcol,Proof of Proposition refpropred,Proof of Corollary refcorDAG,Proof of Theorem refthmgraphical,Proof of Corollary refcorDAGgraphical,Proof of Proposition refpropmes0,Proof of Proposition refpropconsistent,Proof of Theorem refthml0,Algorithm for Enumerating Members of a Distribution Equivalence Class and Determining the Equivalence of Two Structures,Virtual Edge Search Operator,Score Decomposability,Effect of Sample Size on the Performance
Latex_files/full/expanded/190804209.tex,Introduction,Related work,Methodology,Experimental Setup,Results,Conclusions,Parameter Estimation in EM,GP Model,Partial Derivatives in GP
Latex_files/full/expanded/210311651.tex,Introduction,Problem definition,Methods,Results,Discussion
Latex_files/full/expanded/190700692.tex,Introduction,Information Extraction,Open information extraction,Conclusion,Introduction,GLAEE,CRFConditional Random Fields,Template filling through information extraction,knowledge capitalization system,Twolevel approach for extracting events,Comparative analysis,Conclusion,Introduction,System architecture,Extraction process,Illustrative examples,Conclusion,Introduction,Test metrics,Implementation,Evaluation,Conclusion
Latex_files/full/expanded/170401074.tex,Introduction,Related Work,Emotional Chatting Machine,Data Preparation,Experiments,Conclusion and Future Work,Acknowledgments
Latex_files/full/expanded/210609885.tex,Introduction,System Overview,Experimental Setup,Results and Analyses,Summary and Conclusion,Acknowledgements
Latex_files/full/expanded/161201857.tex,Relational Generalisations,Pawlaks Rough Sets,Standard Dual Relational Generalisation of  Rough Set Approximations,NonDual Relational Generalisation of Rough  Set Approximations,Conclusion
Latex_files/full/expanded/181201488.tex,Introduction,Preliminaries and Notation,Start State Fisher Information Matrix Over IntraOption Path Manifold,Start State Fisher Information Matrix Over StateOption Transition Path Manifold,Incremental Natural Option Critic Algorithm,Experiments,Discussion
Latex_files/full/expanded/210213419.tex,Introduction,Background,Experiments,Network Architecture and Training Details
Latex_files/full/expanded/190907926.tex,Introduction,Pairwise disagreement and position bias ,Changing the sampling of the products in the metric  ,Experimental results on Criteo data ,Variants and further work ,Formalized presentation,Implementation when products are sampled from a PlackettLuce distribution 
Latex_files/full/expanded/210409498.tex,Introduction,Related Work,Correspondencewise Image Prediction,Results,Discussion,Toy Image Prediction Details,Training and Architecture,Design Decisions,Frame Interpolation Details,Model Predictive Control,Correspondencewise Averages,Human Study Details,Smoothness Tradeoffs
Latex_files/full/expanded/170408715.tex,Introduction,Siamese neural networks,Deep Forest,Three ideas underlying the SDF,The SDF construction,The SDF training and testing,Numerical experiments,Conclusion
Latex_files/full/expanded/210912131.tex,Introduction,Background,System Overview,Change Detection,Datasets,Evaluation of Change Detection,Related Work,Discussion,Conclusions
Latex_files/full/expanded/210703050.tex,Introduction,Related Work,Methodology,Experiments and Results,Conclusion
Latex_files/full/expanded/200207971.tex,Introduction,Related Work,Model,Applications,Experiments,Ablation study,Conclusion,Additional Related Work,Algorithm Pseudocode,Additional Dataset Statistics,Hyperparameters of GrowNet,XGBoost and AdaNet Tuning,Additional Illustrations for Ablation Study
Latex_files/full/expanded/190603548.tex,Introduction,Related WorkBackground on normalization methods,Improving Normalization What Everyone Should Know,Additional Experiments,Conclusion,Proof of Batch Normalization Output Bounds,Empirical Evidence of Batch Normalization Output Bounds,Negative Results Approaches That Didnt Work,Supplemental Inference Example Weighing Plots 
Latex_files/full/expanded/180800628.tex,Introduction,Problem Statement,Review of Fusion Penalties,Fusion Subspace Clustering,A Natural Generalization to Missing Data,Model Selection,Experiments,Future Directions
Latex_files/full/expanded/210100200.tex,Introduction,Related Work,Proposed Method,Experiment Setting,Experiment Results,Conclusion
Latex_files/full/expanded/170503176.tex,Introduction,The Swarm Algorithm,Local Path Planning,Implementation Details and Simulation Results
Latex_files/full/expanded/210303518.tex,Introduction,Related works,Methodology,Experimental setup,Experiments,Conclusions
Latex_files/full/expanded/180200822.tex,Introduction,BNNs using Variational Inference,VIBNN Architecture Overview,BNNOriented GRNGs,FPGABased Implementation of VIBNN,Experimental Results and Analysis,Conclusion
Latex_files/full/expanded/200203854.tex,Introduction,Background and Related Work,Proposed Methodology,Experimentation and Results,Conclusions and Future Work
Latex_files/full/expanded/190701949.tex,Introduction,Background And Related Works,Method,Experiments,Conclusions
Latex_files/full/expanded/200102394.tex,Introduction,Related Work,DenseNets,Results,Architecture Hyperparameters,DenseNet variants,Conclusion
Latex_files/full/expanded/190309879.tex,Introduction,DATA,METHOD,EXPERIMENTS,CONCLUSION
Latex_files/full/expanded/210302363.tex,Evaluation,Conclusion,Introduction,Proposed Method
Latex_files/full/expanded/200207703.tex,Introduction,Fully Convolutional Neural Networks for Segmentation,EncoderDecoder Neural Networks for Segmentation,Recurrent Neural Networks for Segmentation,Generative Adversarial Networks for Segmentation,Weakly Supervised Learning for Segmentation,Reinforcement Learning for Segmentation,Evaluation Methods Datasets and Results,Discussion and Potential Directions
Latex_files/full/expanded/200211018.tex,Background and Notation,Batch normalization in the LRP relevance computation,More complex normalizations for convolution layers  from convolutional to fully connected layer,Experiments,Conclusion
Latex_files/full/expanded/200802025.tex,Introduction,Review Programs,Review Representing Programs by FirstOrder Theories,Main Lemma,Programs with Input and Output,Completion and Tightness,Verifying Tight Logic Programs with anthem,Conclusions,Proofs
Latex_files/full/expanded/201014023.tex,Introduction,Background,Problem statement,Membership inference strategies,Membership inference evaluation,Attribute inference,Defenses,Related work,Conclusion
Latex_files/full/expanded/210607356.tex,Introduction,Related Works,Preliminaries,MVKE Model,Experiments,Conclusion
Latex_files/full/expanded/210308200.tex,Introduction,Model,Experiment,Result,Related Work,Conclusion and Future Work
Latex_files/full/expanded/180602891.tex,Introduction,Measuring the Importance of Units for Classification,Experiments,Conclusion
Latex_files/full/expanded/180512164.tex,Introduction,Background,Related Work,PMI linking geometry to semantics ,Encoding PMI from PMI vectors to word embeddings,Empirical evidence,Discussion,Conclusion,Properties of the PMI surface proofs Sec refsecSproperties,Further Geometric properties of the PMI surface,Comparison to embedding relationships of previous works,Why order matters in analogies,Experimental details
Latex_files/full/expanded/8014061.tex,Introduction,Main result
Latex_files/full/expanded/13126157.tex,Introduction,Deep Belief Networks,Proposed Methods,Experimental results,Conclusion
Latex_files/full/expanded/191211323.tex,Introduction,Rules of Spades,To Nil or Not to Nil that is The Question,The BIS Agent,Experimental Evaluation,Conclusion,Sidesuit high cards value for different number of dangerous opponents,Bidding patterns,Branching factor,Interesting aspects in the playing algorithm SRP,Rounds types and endgame conditions,Other bidding Agents,Additional aspects in the bidding,Terminology
Latex_files/full/expanded/210708467.tex,Introduction,Related Work,Setup,Main Results,Experimental Evaluation,Discussions Scope and Conclusions,Appendix large Proofs of the Theorems
Latex_files/full/expanded/180701613.tex,Introduction,Model,Related research,Experimental Results,Discussion
Latex_files/full/expanded/200500724.tex,Introduction,Neural Module Networks,Modulewise Faithfulness,Improving Faithfulness in NMNs,Experiments,Related Work,Conclusion,Modules,Measuring Faithfulness in VisualNMN,Details about Experiments,Significance tests
Latex_files/full/expanded/171205191.tex,Introduction,Supervised Approaches,Joint Extraction of Entities and Relations,Semisupervised Approaches,Unsupervised Relation Extraction,Open Information Extraction,Distant Supervision,Recent Advances in Relation Extraction,Conclusion and Future Research Directions
Latex_files/full/expanded/210900522.tex,Introduction,RELATED WORK,METHODOLOGY,EXPERIMENTS,CONCLUSION
Latex_files/full/expanded/210213233.tex,Introduction,Related Work,Notations and Preliminaries,A Motivating Example,Main Results,Proofs,Conclusion
Latex_files/full/expanded/191112558.tex,Introduction,Related Work,Problem Statement,Proposed Framework,Experimental Setting,Results and Discussion,Conclusion and Perspective
Latex_files/full/expanded/201101412.tex,Introduction,Problem Formulation,Graph Neural Sampling Module,Graph Neural Recovery Module,Multiscale Model Graph Cross Network,Illustration of Sampling and Recovery,Applications,Conclusions
Latex_files/full/expanded/210310426.tex,Introduction,Related Work,Method,Experiments,Conclusion,Appendix
Latex_files/full/expanded/200904550.tex,Introduction,Problem Formulation and Consistency Result,Proof of the Consistency Result,A Probabilistic Interpretation of the Optimization Problem,Algorithm,Penalization,Simulation Studies,Applications,Discussion
Latex_files/full/expanded/180105757.tex,Introduction,Deep Reinforcement Learning DRL,Problem Statement,Proposed DRLbased Control Framework,Performance Evaluation,Related Work,Conclusions
Latex_files/full/expanded/190803883.tex,Introduction,Related work,Unsupervised Neural Quantization,Experiments,Conclusion
Latex_files/full/expanded/170903645.tex,Introduction,Our Model SGLGG,ADMM for Solving SGLGG,Experiments,Conclusion
Latex_files/full/expanded/200406518.tex,Introduction,Preprocessing,Methods,Results,Conclusion
Latex_files/full/expanded/14010509.tex,Introduction,Semantic Utterance Classification,Zeroshot learning,ZeroShot Learning for Semantic Utterance Classification,Learning Semantic Features for SUC using Deep Nets,Learning Discriminative Semantic Features without Supervision,Related work,Experiments,Conclusion
Latex_files/full/expanded/191107509.tex,INTRODUCTION,RELATED WORKS,ALGORITHMS BACKGROUND,THE PILGRIMS DATASET,EXPERIMENTAL EVALUATION,CONCLUSIONS
Latex_files/full/expanded/200614163.tex,Introduction,Related Work,Equivariance,Experiments,Conclusion
Latex_files/full/expanded/210513636.tex,Introduction,Related Work,Density Ratio Matrix Estimation for MSPRT,Experiment,Conclusion,Asymptotic Optimality of MSPRT,Supplementary Related Work,Proof of Theorem refthmconsistency of LSEL,Modified LSEL and Logistic Loss,Performance Comparison of LSEL and Logistic Loss,MTANDEM vs MTANDEMwO Formulae,Proofs Related to GuessAversion,Ablation Study of Multiplet Loss and LSEL,Details of Experiment and More Results,LLR Trajectories,Details of Statistical Tests,Supplementary Discussion
Latex_files/full/expanded/180400645.tex,Introduction,Universal Planning Networks,Related Work,Experiments,Discussion,Acknowledgements,UPN Architecture details,Actionselection with Model Predictive Control MPC,Demo collection,Imitation Learning Comparisons  Description and architecture details,Imitation Learning Benchmarks Experimental Setup,PPO Parameters,Reinforcement Learning Benchmarks Experimental Setup,Camera viewpoint for each task,Exponential of distance metrics for rewards,Open Source Frameworks
Latex_files/full/expanded/190911275.tex,Introduction,Related work,Switched linear projections SLP,Input component decomposition ICD,Singular pattern analysis SPA,Inactive state,Sanity checks,Conclusion,Proof of Theorem refthrmswitchedprojs
Latex_files/full/expanded/211004752.tex,Introduction,Problem Description,Data Perturbation,Related Work,Experiments and Results,Conclusion and Future Work
Latex_files/full/expanded/200205646.tex,Introduction,Industry Survey about Adversarial ML ,About SDL,Gaps during Development of ML Solution ,Gaps when Preparing for Deployment of ML System  ,Gaps when an ML System is under attack,Conclusion ,Acknowledgement
Latex_files/full/expanded/200205412.tex,Introduction,Methods,Data,Experiments and results,Conclusion,Acknowledgments
Latex_files/full/expanded/11090455.tex,Introduction,Gradientbased kernel dimension reduction,Experimental results,Concluding remarks,Consistency of the kernel estimator for the regression function,Proof of Theorem refthmconvergence
Latex_files/full/expanded/210911576.tex,Introduction,Results,Discussion,Methods
Latex_files/full/expanded/13114064.tex,Optimization,The ThreeWeight Algorithm TWA,Integrating Knowledge with the TWA,Demonstrations,Discussion
Latex_files/full/expanded/210512034.tex,Introduction,Hyperparameter Selection,Experimental Results,Related Work,SummaryConclusion,Experimental details,Additional results
Latex_files/full/expanded/190602461.tex,Introduction,Related Work,Unsupervised Pivot Translation,Experiments Design,Results,Conclusions and Future Work,Background
Latex_files/full/expanded/200700953.tex
Latex_files/full/expanded/170303543.tex,Introduction
Latex_files/full/expanded/210902914.tex,Appendix A Power laws in supervised learning,Appendix B Power laws in Ising patterns
Latex_files/full/expanded/191011583.tex,Introduction,Background,Joint framework,Experiments,Conclusion,Datasets,Implementation details,Qualitative comparison between ComplEx and JoBi ComplEx,Experiments with fullsoftmax
Latex_files/full/expanded/190804030.tex,Introduction,Related Work,Bzier curves with Gaussian control points,mathcalNCurve Mixture Density Networks,Real world evaluation,Conclusions and Future Works
Latex_files/full/expanded/191011509.tex,Introduction,Related work and background,Methods,Experiments,Results  Discussion,Conclusions
Latex_files/full/expanded/210801473.tex,Introduction,Related work,Proposed Method,Experimental Results and Analysis,Conclusions and Future work
Latex_files/full/expanded/190807934.tex,Introduction,CSI Feedback System,Experiments and Numeral Results,Conclusion
Latex_files/full/expanded/201201174.tex,Introduction,Intrusion Detection System Taxonomy,IDS for IoT,The EdgeEnabled approach,Open Issues for Edgeenabled architectures,Machine Learning Techniques Applied to IDSs,Conclusions
Latex_files/full/expanded/200405529.tex,Introduction,Related Work,Gradientbased Features for Representation Learning,Experiments,Conclusion
Latex_files/full/expanded/191201098.tex,Introduction,Experimental Results
Latex_files/full/expanded/190410112.tex,Introduction,Related Work,Preliminaries,Main Results,Applications and Experiments,Conclusion,A Lemma Regarding mathcal Ax,Proof of LemmareflemmaconvergenceRSPDscperstage,Proof of Lemmareflemmaconvergencerspdperstage,Proof of Theoremreftheoremconvergencerspdadaptivec Theoremreftheoremconvergencerspdadaptivetheta,Piecewise Quadratic Function of Distributionally Robust Optimization
Latex_files/full/expanded/200611300.tex,Introduction,Related Work,Problem Formulation,Specification Model,Causal Modeling,Parameterization of Specifications,Experimental Setup,Results,Conclusion
Latex_files/full/expanded/210313813.tex,Introduction,Background and Related Works,Defense Intuition,Proposed bnns,Experimental Details,Results,Conclusion,emphgrows training effect,emphLayerwise bitflip analysis,emphDefense HyperParameters
Latex_files/full/expanded/200811174.tex,Introduction,Related Work,Method,Experimental Results,Conclusion
Latex_files/full/expanded/170607145.tex,Introduction,Quantized Neural Networks,Balanced Quantization for Neural Network Parameters,Experiments,Conclusions,Eliminating All Floating Point Operations During Inference,Training Algorithm of QNN,Proof of Propositionrefthmbalancedquantizationk,Quantization of GRU,Quantization of LSTM
Latex_files/full/expanded/190906543.tex,Introduction,Related Work,Problem Definition,Proposed Framework,Experiments,Conclusion
Latex_files/full/expanded/180904720.tex,Introduction,Related Work,Preliminaries,Deep Reinforcement Learning for a Task with Complex Dynamics,Implementation,Results,Discussion and Future Work
Latex_files/full/expanded/200614988.tex,Introduction,Related Work,Preliminaries,Transductive Regularisation,Experiments,Conclusions,Additional Results
Latex_files/full/expanded/190600216.tex,Introduction,Robust Learning with Iterative noisefiltering ,Related Works,Evaluation,Conclusion,Complete removal of samples,Training process,Training details,Losses
Latex_files/full/expanded/210605923.tex,Introduction,Literature Review,Challenge Tasks,Dataset Collection,Segmentation,Registration and Mosaicking,Conclusion
Latex_files/full/expanded/190909598.tex,Introduction,Related Works,Proposed Method,Experiments,Mobile Application,Conclusion
Latex_files/full/expanded/210108032.tex,Numerical Experiments and Results,Discussion and Conclusion,Introduction,Related Work,Riemannianbased Discriminant Analysis RDA
Latex_files/full/expanded/170608605.tex,Introduction,Motivation,Background The Lean Theorem Prover,Case Study Certified Stochastic Computation Graphs,Discussion
Latex_files/full/expanded/190705572.tex,Introduction,Sequence Modeling Problem,The RTransformer Model,Experiment,Related Work,Conclusion
Latex_files/full/expanded/200300822.tex,Introduction,Related Work,Precision Batching,Results,Discussion
Latex_files/full/expanded/210609538.tex,Introduction,Methods,Results,Conclusion
Latex_files/full/expanded/14050805.tex,Introduction,Background,Relative Expressiveness,Discussion
Latex_files/full/expanded/210204798.tex,Introduction,Related Work,Proposed Methods,Experimental setup and results,Conclusions
Latex_files/full/expanded/200212860.tex,Introduction,Background and Definitions,Experiments,Conclusion and Future work,Quantile Regularization
Latex_files/full/expanded/191004536.tex,INTRODUCTION,RELATED WORK,BACKGROUND,DEEP STRUCTURED MIXTURE OF GAUSSIAN PROCESSES,EXPERIMENTS,CONCLUSION,Shared Cholesky Decomposition,Datasets,Scores,Algorithms
Latex_files/full/expanded/210901295.tex,Introduction,Related work,Methodology,Experiments,Conclusion
Latex_files/full/expanded/200405716.tex,Introduction,Related Work,Baseline Algorithms,Personalized Similar Product Recommendation,Experiment,Conclusion
Latex_files/full/expanded/191206858.tex,Introduction,Methodology,Related Works,Leicester Scientific Corpus LSC,Leicester Scientific Dictionary LScD,Leicester Scientific DictionaryCore LScDC,A Comparison of LScDC and NAWL,Conclusion and Discussion,Acknowledgement,An Example of Document Structure in the LSC,List of Categories,List of Research Areas,Lists of Prefixes and Substitutes,List of stop words in tm package R package
Latex_files/full/expanded/200413233.tex,Conclusion
Latex_files/full/expanded/210109230.tex,Introduction,Related Work,Methods,Results,Conclusion
Latex_files/full/expanded/201113885.tex,Introduction,Method,Experimental setup,Experimental results,Data set ablations,Related work,Conclusion,Training procedure details,Positiveunlabeled learning,Taskrelevant adversarial imitation learning
Latex_files/full/expanded/190102739.tex,Introduction,Preliminaries,Model description,Experimental results,Conclusion,MonteCarlo estimation on the marginal likelihood,KL divergence of two multiGamma distributions,Hyperparameter boldalpha learning strategy,Experimental settings
Latex_files/full/expanded/210904007.tex,Introduction,Survey of existing web apps for materials discovery,MaterialsAtlas Platform of Materials Discovery Tools,Future work,Conclusion,Contribution,Acknowledgement
Latex_files/full/expanded/210501004.tex,Introduction,Problem Formulation,Solution,Experiments and evaluation,Related Work,Conclusion and future work
Latex_files/full/expanded/190109462.tex,Introduction,Materials and methods,Results and discussion,Conclusion
Latex_files/full/expanded/201006007.tex,Introduction,Related Worklabelsectionrelatedworks,Methodlabelsectionmethod,Experimentslabelsectionexperimentalsetup,Conclusionlabelsectionconclusion,Hyperparameters and Training Details,Real Dataset,Sample waveforms and spectrograms,Sampling Rate
Latex_files/full/expanded/210401374.tex,Introduction,The Image Restoration Task,Nonhierarchical VAE Based Diversity Denoisers,Hierarchical DivNoising,Denoising with HDN,Interpretable Structured Noise Removal with HDN,Conclusions And Future Work,Appendix
Latex_files/full/expanded/150501757.tex,Introduction,Background,Hidden Markov Model,Farsi Hidden Markov Model,Training and Testing of HMM,Conclusion and Future Work
Latex_files/full/expanded/170306749.tex,Introduction and related work,Variational Bayes,Ensembles and outlier detection,Experiments and results,Conclusion,Results using textitnoisy Adam as approximation for SGLD
Latex_files/full/expanded/210500108.tex,Introduction,Generalizing DeepSHAP local explanations,Incorporating a baseline distribution,Explaining a series of models,Discussion,Methods,Acknowledgements,Competing Interests,Data availability,Code availability,Author Contribution,Appendix
Latex_files/full/expanded/190912086.tex,Introduction,Related Work,The GECOR Model,TaskOriented Dialogue with GECOR,Data Annotation for Ellipsis and CoReference Rosultion in Dialogue ,Experiments,Conclusion and Future Work
Latex_files/full/expanded/200212351.tex,Introduction,Conventional Image Reconstruction Approaches,Deep Learning Based Image Reconstruction ,Medical Training Datasets,Reconstruction Evaluation Metrics,Conclusion Discussion and Future Direction
Latex_files/full/expanded/211009927.tex,Introduction,Related Work,Experiments,Conclusion
Latex_files/full/expanded/210406357.tex,Introduction,Semirings and Pairwise Distances,GPUAccelerated Semirings,Experiments,Related Work,Conclusion,Appendix
Latex_files/full/expanded/210301713.tex,Introduction,A Framework for Distributional Formal Semantics,A Model of Incremental Semantic Construction,Inference during Semantic Construction,Discussion,Conclusion,Probabilistic constraints,Model Selection algorithm
Latex_files/full/expanded/211009344.tex,Introduction,Related Work,IntrusionFree Graph  Mixing,Experiments,Conclusions and Future Work,Appendix
Latex_files/full/expanded/210610633.tex,Introduction,Methods,Case study application Early detection of alcoholism predisposition,Discussion and Conclusions
Latex_files/full/expanded/9083091.tex,Introduction,Mathematical Preliminaries,Lagrange Coordinatizations of Groups,Coordinate Manipulation,An Application Permutation Puzzles,Conclusion and Future Work
Latex_files/full/expanded/180908391.tex,Introduction,Fake faces,Approaches to Verify computer face understanding ,Collection of Fake face Database,Experiments,Conclusion
Latex_files/full/expanded/190107957.tex,Introduction,Introduction to the CTC approach,CTCModel an extension of a Keras Model,Experimentations,Conclusion
Latex_files/full/expanded/171206651.tex,Introduction,Dataset,Crossmodal retrieval,Localizing objects that sound,Conclusions and future work,AudioSetInstruments,Initialization for the AVENet,AVEOF architecture,Additional AVENet results
Latex_files/full/expanded/200710261.tex,Introduction,Fewshot link prediction formulation,Learning inductive embedding for GNNs,Experiments,Conclusion,Datasets
Latex_files/full/expanded/200210295.tex,Related Work,Future Work,Conclusions,Introduction,Parametrization optimization,An LCS architecture for continuous problems,lcsone A first implementation of lcs,Evaluation
Latex_files/full/expanded/190709520.tex,Introduction,Overview of locomotion models and simulation frameworks,vadere A framework to compare different locomotion models,Conclusion,Acknowledgments,Appendix
Latex_files/full/expanded/200403194.tex,Introduction,Relation to prior works,Proposed approach,Experimental setup,Results,Conclusions,Acknowledgements
Latex_files/full/expanded/200502259.tex,Introduction,Related work,Problem setting,name,Experiments,Conclusions and limitations,Popper metarule theory constraints,Language biases in buttons experiment,Language biases in robots experiment,Language biases in lists experiment
Latex_files/full/expanded/210504098.tex,Introduction,Related Work,Model,Experiment,Further Analysis,Conclusion and Future Work
Latex_files/full/expanded/200710306.tex,Introduction,Methods,Results,Discussion,Conclusion,Acknowledgements and Funding,Supplementary Cohort Tables,Feature Extraction,Hyperparameters,Supplementary Figures
Latex_files/full/expanded/201008920.tex,Introduction,Preliminaries,Valueiteration schemes,Policyiteration schemes,Discussion,Tables of existing works,Taxonomy for approximation techniques,Existing benchmarking environments
Latex_files/full/expanded/210509567.tex,Introduction,Related Work,The Proposed Approach,Experiments,Conclusion
Latex_files/full/expanded/190604493.tex,Introduction,Predictability Minimization PM,Convergence of Unsupervised Minimax,Conclusion
Latex_files/full/expanded/160902082.tex,Introduction,Probabilistic distortion model for spatial diffuseness features,Improved uncertainty decoding with weighted samples,DNNHMM hybrid system,Experiments,Conclusions,Acknowledgements
