Latex_files/full/expanded/180601678.tex,Introduction,Background and Related Work,MetricConstrained LPs and Graph Clustering,Projection Methods for Quadratic Programming,Implementing Dykstras Method for MetricConstrained Optimization,Approximation Guarantees for Clustering Objectives,Improved A Posteriori Approximations,Experiments,Discussion and Future Challenges,Projection Methods and Quadratic Programming
Latex_files/full/expanded/201210506.tex,Introduction,Literature Review,The Problem,Solution Framework,Experimental Results,Conclusions and Future Work
Latex_files/full/expanded/190505635.tex
Latex_files/full/expanded/201010054.tex,Introduction,Related work,Our approach,Experimental evaluation,Analysis,Conclusion
Latex_files/full/expanded/191001803.tex,Introduction,Related Work,Proposed Method,Experiments,Results,Conclusion
Latex_files/full/expanded/200612001.tex,Introduction,Background,Task Description,Methods,Experiments,Related Work,Conclusion,Appendix
Latex_files/full/expanded/180603486.tex,Introduction,Related work,Learning from a single demonstration,Experiments,Discussion,Conclusion
Latex_files/full/expanded/201006209.tex,Introduction,Contributions,Proposed Architecture,Results
Latex_files/full/expanded/200905602.tex,,Assessing the resilience of GNN for malware detection,Related Work,Conclusion,Algorithm of the SRI Attack,Algorithm of the SGI Attack,Malware Classification Results,Data distribution for each type of program,Performance of the SRL attack,Injected Features,Impact of the injected opcodes,Introduction,Background,Problem Statement,Attacks on Graphbased Malware Detection Model
Latex_files/full/expanded/180307624.tex,Introduction,Related Work,Largely Sampled Dynamic Filtering,Experiments,Conclusion
Latex_files/full/expanded/160300810.tex,Introduction,Neural Machine Translation,Characterbased Machine Translation,Experimental framework,Conclusions
Latex_files/full/expanded/201004147.tex,Introduction,Related Work,Methods,Results,Conclusion
Latex_files/full/expanded/12123669.tex,Introduction,A model to classify vulnerabilities and exploits,Results,Conclusion
Latex_files/full/expanded/190902982.tex,Introduction,Context and Background,Model and Design Goals,Design of tool,Implementation,Experts Evaluation,Discussion,Perspectives,Conclusion,Acknowledgement
Latex_files/full/expanded/160301354.tex,Introduction,Neural Network Architecture,Network Training,Experiments,Related Work,Conclusion
Latex_files/full/expanded/190601530.tex,Introduction,Related Work,Task Description and Setup,Data Collection,Dataset Analysis,Reference Chain Extraction,Experiments on Reference Resolution,Conclusion,Task Setup,Task Instructions,Dataset Samples,Reference Chain Extraction,Reference Resolution Experiments
Latex_files/full/expanded/210607550.tex,Introduction,Attention based deep learning architectures,Attention and deep learning in machine vision Broad categories,Major research algorithms issues and trends,Conclusion
Latex_files/full/expanded/210314512.tex,Introduction,Experimental Setup,Methods,Results,Conclusion
Latex_files/full/expanded/180311347.tex,Introduction,Related Work,Preliminaries,MetaLearning for Online Model Adaptation,ModelBased MetaReinforcement Learning,Experiments,Conclusion,Model Prediction Errors Preupdate vs Postupdate,Effect of MetaTraining Distribution,Sensitivity of K and M,Reward functions,Hyperparameters
Latex_files/full/expanded/200911207.tex
Latex_files/full/expanded/200504560.tex,Introduction,Control States for Blackbox Generation,Posterior Regularization of Control States,Structured Variational Family for Segmental Generation,Posterior Constraints from Data Alignment,Related Work,Experimental Setup,Experiments,Analysis,Conclusion
Latex_files/full/expanded/210805053.tex,Introduction,ML Feature Stores,Data Management and Embedding Ecosystems,Future Directions,Biographical Sketches
Latex_files/full/expanded/210708383.tex,Introduction,Preliminaries,GuideBoot,Online GuideBoot,Experiments,Conclusion and Discussion
Latex_files/full/expanded/200800397.tex,Introduction,Related Work,Approach,Experiments,Conclusion
Latex_files/full/expanded/211012320.tex,Introduction,Related Work,Problem formulation,Proposed EndtoEnd Pipeline  CoVA,Dataset Generation,Experimental Setup  Results,Ablation Studies,Conclusion  Future Work
Latex_files/full/expanded/160807879.tex,Introduction,Causality and Responsibility  Definitions,Coverage in the framework of causality,Explanation of Counterexamples Using Causality,Responsibility in Symbolic Trajectory Evaluation,ldots and Beyond
Latex_files/full/expanded/191108610.tex,Copyright,Formatting Requirements in Brief,What Files to Submit,Using LaTeX to Format Your Paper
Latex_files/full/expanded/200301351.tex,Introduction,DETECT,Related Work,Conclusion,Acknowledgement
Latex_files/full/expanded/190809710.tex,Introduction,Background,Variational graph recurrent neural network VGRNN,Experiments,Conclusion,Acknowledgments
Latex_files/full/expanded/190908611.tex,Introduction,Related work,Discovery of prominent spatiotemporal feature combinations,Computational complexity and latency,Visualization results,Conclusion
Latex_files/full/expanded/201104184.tex,Introduction,Related work,Methodology,Experiment Settings,Results and Discussion,Conclusion
Latex_files/full/expanded/210504313.tex,Introduction,Related Work,Method,Information Extraction From Invoices,Discussion,Conclusion
Latex_files/full/expanded/190508193.tex,Introduction,Data,Model fits,Discussion,Conclusions
Latex_files/full/expanded/150800116.tex,Related Work,Contribution of the work,Organization of the Report,Constraint Systems,The Logic sroiqc,Tableau Algorithm for SROIQC,Issues with Extensions,A decision procedure for gcsr,Conclusion and Future Work,Termination,Soundness,Completeness
Latex_files/full/expanded/210704767.tex,Introduction,Related Work,Methodology,Experiment,Result and Discussion,Conclusion
Latex_files/full/expanded/191110787.tex,Introduction,Related Work,Causal GenderDebiasing,Experiments,Conclusion
Latex_files/full/expanded/180203360.tex,Introduction,Naive Bayes,Supervised LDA,Deep Neural Network,Discussion,Conclusion
Latex_files/full/expanded/12064116.tex,Introduction,Dependence Maximizing Temporal Alignment via SMI,Related Methods,Experiments,Conclusions
Latex_files/full/expanded/191107498.tex,Setup and Algorithm,Theoretical Analysis,Enhanced Algorithm With Sketching,Experiments,Conclusion,Acknowledgement,Introduction
Latex_files/full/expanded/201204634.tex,INTRODUCTION,ENERGYBASED MODELS FOR REGRESSION,METHOD,EXPERIMENTS,CONCLUSION
Latex_files/full/expanded/200610103.tex,Introduction,Profiling Training Performance,WhatIf Analysis,Discussion and Future Work
Latex_files/full/expanded/190713627.tex,Introduction,Related Work,Problem Formulation,Methodology,Experiments Evaluation and Results,Conclusion,Data Processing and Network Architecture,Plan Segmentation Elaboration,Disentanglement Analysis of the Information Bottleneck mathbfC
Latex_files/full/expanded/10070776.tex,Introduction,Empirical analysis,Voting rules,Voting distributions,Results,Other manipulation problems,Conclusions
Latex_files/full/expanded/211109194.tex,Introduction,Related Works,Background and Definition,Theoretical Framework ,IntervalValued Graph Neural Network IVGNN,Experiments,Conclusion
Latex_files/full/expanded/171007016.tex,Introduction,Method,Results,Conclusions
Latex_files/full/expanded/12092097.tex,Introduction,Semantic web and math,Semantic web math engineering and environment,RDF and automated reasoning,RDF and visualizations Mimirix and other examples,Conclusion,Acknowledgement
Latex_files/full/expanded/180600148.tex
Latex_files/full/expanded/180202498.tex,Introduction,Preliminaries,Algorithm,Performance Guarantees,Experiments,Related Work,Sample Complexity  Proof of Theoremrefthmmpc,Proof of Theorem refthmrcfm
Latex_files/full/expanded/200107301.tex,Introduction,Improved standard parameterization,Experiments,Discussion
Latex_files/full/expanded/160300106.tex,Introduction,Related Work,Model,Experimental Evaluation,Conclusions,Supplementary Data,Acknowledgements
Latex_files/full/expanded/200403042.tex,Introduction,Related Work,Method,Experiment and Results,Performance Evaluation on Mobile Devices,Conclusions
Latex_files/full/expanded/210612442.tex,Introduction,Related Work,The EuroPVI Dataset,JointbetacVAE A Joint Trajectory Model for Dense Urban Environments,Experiments,Conclusion and Outlook,Introduction,Further Details about the EuroPVI dataset,Further Details of our JointbetaCVAE and Additional Evaluation
Latex_files/full/expanded/211004357.tex,Introduction,Preliminaries,Approach,Related Work,Experiments,Conclusion,Appendix,Pretrained Policy,Transition Policy,Deep Q Network
Latex_files/full/expanded/200802070.tex,Introduction,Related work,Formalization,Dataset,Methodology,Experiments,Results,Conclusions
Latex_files/full/expanded/150203945.tex,Introduction,Preliminaries,Existence and quality of equilibria,Complexity of equilibria,Enforcing equilibria using subsidies,Discussion and open problems
Latex_files/full/expanded/210803793.tex,Introduction,Laying a common ground by clarifying terms,A practical Test for HLAI,A cognitive architecture for HLAI,Experiment Plan,Intellectual Merit
Latex_files/full/expanded/210903941.tex,Introduction,Related Work,The Models,Experiment Setup,Experiment Results,Conclusions and Discussion
Latex_files/full/expanded/180503876.tex,Introduction,Preliminaries,Multiarmed bandit for adaptive search,Experiments,Conclusion,Acknowledgments
Latex_files/full/expanded/210500872.tex,Introduction,System model and Problem formulation,FL Convergence Analysis,Design principle for FL,Experiments,Conclusion,Preparations,Lemma refgt,Lemma refcrossbd,Lemma refmathinduction,Proof of Theorem refestimateGepsilon,Proof of Theorem refKresult,Proof of Theorem reftaj
Latex_files/full/expanded/170300560.tex,Introduction,Related Works,Problem Definition,The Analytical Formula,Critical Point Analysis,Convergence Analysis,Simulations,Extension to multilayer ReLU network,Conclusion and Future Work
Latex_files/full/expanded/7070808.tex,Introduction,Camera Phone Interface,Computer Vision with Uncommon Maps,Analysis of System Performance,Future Work,Conclusion,Acknowledgements
Latex_files/full/expanded/200802754.tex,Introduction,Related work,Discovering language biases,Validation on Google News,Reddit Datasets,Discussion,Further experiments on rTheRedPill,Most Frequent Biased Concepts,Target and Evaluative Sets
Latex_files/full/expanded/200604212.tex,Introduction,Related Work and Background,StockGAN,Experimental Results,Limitations and Conclusion
Latex_files/full/expanded/211100162.tex,Introduction,Related Work,The Lottery Ticket Claims its Ownership,Experiments,Conclusion and Discussion of Broad Impact,More Methodology Details,More Experimental Results
Latex_files/full/expanded/211003687.tex,Introduction ,Related work,Data Processing and Labelling,Early Detection Model,Conclusion,Appendix
Latex_files/full/expanded/211014855.tex,Introduction,Related Work,Loss Landscape Analysis,Adversarial Training of GNNs,Experiments,Conclusion,Appendix
Latex_files/full/expanded/211007356.tex,Introduction,Generalizable Insights about Machine Learning in the Context of Healthcare,Related work,Datasets,Evaluation Metrics,Experiments and Results,Conclusion
Latex_files/full/expanded/190508392.tex,Introduction,Background Research,Dataset,Modeling the Data Generating Process,Network Architectures,Training the Networks,Baseline Methods,Experimental Results,Conclusion
Latex_files/full/expanded/151106807.tex,Introduction,Related work,Method,Experiments,Conclusion
Latex_files/full/expanded/210803988.tex,Introduction,Related work,Problem definition,The learning system,discussion,Roadmap to Artificial General Intelligence,Conclusion
Latex_files/full/expanded/210711876.tex,Introduction,Diffusion probabilistic models,DiffuSE architecture,Experiments,Experimental Results,Conclusions,Acknowledgement
Latex_files/full/expanded/210508291.tex,Introduction,Related Work,Prediction Model,Experiments,Conclusion
Latex_files/full/expanded/170902023.tex,Introduction,Related Work,Background,Causal Implicit Generative Models,Causal Generative Adversarial Networks,Theoretical Guarantees for CausalGAN,Implementation,Results,Conclusion,Appendix
Latex_files/full/expanded/200505178.tex,Introduction,Problem Statement,Related Work,AdmiralNet Mapping Context to Intent,Experimental Results,Conclusion and Future Work
Latex_files/full/expanded/170907576.tex,Introduction,Guided Local Search,Literature Review,Big Valley Structure,Elite Biased Guided Local Search,Behavior of Elite Biased Guided Local Search,Performance Comparison,Conclusions
Latex_files/full/expanded/181107308.tex,Introduction,Model,Uncertainty Measure,Experiments,Related Work,Conclusion,Derivation,Detailed Dataset,Effects on KLdivergence
Latex_files/full/expanded/200512339.tex,Introduction,Understanding the Label Space,Structured Label Spaces,Response Driven Learning,Conclusion
Latex_files/full/expanded/151106388.tex,Introduction,Related Work,Named Entity Resolution,Neural Dependency Parsing,Conclusion and Future Work
Latex_files/full/expanded/210511452.tex,Gfootnotesize rfootnotesize ,Yntem,Deneysel alma,Sonu
Latex_files/full/expanded/200304173.tex,Introduction,Related work,Methods,Experiments,Conclusion
Latex_files/full/expanded/210809676.tex,Introduction and Motivation,Conditional and Gaussian Neural processes,Experiments,Conclusion and further work,Acknowledgements,Consistency,Experimental details
Latex_files/full/expanded/150304358.tex,Motivation,Method,User interface and first observations,Future work and discussion
Latex_files/full/expanded/190911886.tex,Introduction,PRIOR WORKS,PROPOSED APPROACH,EXPERIMENTAL SETUPS,RESULTS,Conclusions,ACKNOWLEDGEMENTS
Latex_files/full/expanded/200406298.tex,Introduction,Definitions and Formulations,Learnability,Theoretical Properties,Experiments,Directions for Future Work,Proofs Omitted from the Main Text,Experiments labelappxexp
Latex_files/full/expanded/161202814.tex,Introduction,Preliminaries,Proposed Model,Experiments,Discussion,Related Work,Conclusion and Future Work,Feature Engineering for traditional supervised models,Derivation of Taskspecific Embedding for Author Identification,Derivation of Pathaugmented General Heterogeneous Network Embedding
Latex_files/full/expanded/210800587.tex,Introduction Background and Motivation,Approach,Contrast Learning and SimCLR,Transfer Learning and Knowledge Distillation,Implementation,Experiments and Results,Discussion
Latex_files/full/expanded/170508868.tex,Introduction,Preliminaries,Flow Generative Adversarial Networks,Hybrid learning of FlowGANs,Interpreting the results,Discussion,Conclusion,Experimental setup details,Sample quality,Gaussian mixture models,Explaining loglikelihood trends
Latex_files/full/expanded/160500596.tex,Introduction,Learning Setting,The Algorithm,Experiments
Latex_files/full/expanded/190206383.tex,Introduction,Colourbased texture descriptor,Dualstream convolutional neural network,Ethnicocular dataset,Experiments,Conclusion
Latex_files/full/expanded/210803336.tex,Introduction,The statistical model sample eigenvalues and a new measure of signal strength,The three key pieces for crossvalidated eigenvalues,Crossvalidated eigenvalue estimation,Poisson vs Bernoulli,Comparing to other approaches,Discussion,Technical proofs,Supporting figures and tables
Latex_files/full/expanded/201104418.tex,Introduction,Deep Learning,Simulated Dataset,Improving Techniques,Simulation Results,Generalization and Robustness,Discussion
Latex_files/full/expanded/210212828.tex,Introduction,Background,System Overview,Experimental Setup,Results,Conclusion,Acknowledgments
Latex_files/full/expanded/190209434.tex,Introduction,Related work,Continual State Representation Learning with SelfTriggered Generative Replay,Experimental setting,Conclusion
Latex_files/full/expanded/161106585.tex
Latex_files/full/expanded/191200019.tex,Introduction,Related Works,Proposed System Description,Experiment Design,Results,Conclusions
Latex_files/full/expanded/201208929.tex,Introduction,Vessel tracking using conventional machine learning,Vessel tracking based on deep learning,Evaluation issues,Conclusion and discussion
Latex_files/full/expanded/210316935.tex,Introduction,Data model and problem formulation,Network description,Results,Conclusions
Latex_files/full/expanded/170702494.tex,Introduction,Related Work,Methodology,Results,Summary,Acknowledgement
Latex_files/full/expanded/201104333.tex,Introduction,Related Works,Task Modeling,Algorithm,Experiments,Conclusion and Future Work
Latex_files/full/expanded/190308901.tex,Introduction,Data setslabeldata,Methods labelmethods,labelresultsResults and discussion,Conclusions
Latex_files/full/expanded/201005888.tex,Introduction,Background,The system Design,The system Implementation,Applications,Performance Evaluation,Related Work,Concluding Remarks,Convergence with Time,Convergence with MDA as a GAR,Effect of The Number of Byzantine Machines,Throughput in PyTorch,Parameter Vectors Alignment
Latex_files/full/expanded/200810599.tex,Introduction,Related Work,Method,Experiments,Discussion,Implementation Details,Proof of Theoremrefeqapproxthm,Visualizing Pixel Hessians,Hessian Penalty Heatmaps
Latex_files/full/expanded/200701866.tex,Introduction,Related WorkLiterature Review,Methods,Dataset and features,ExperimentsResultsDiscussion,ConclusionFuture Work,Contributions  Acknowledgements
Latex_files/full/expanded/210612300.tex,Introduction,Related Work,Individual and Group Federated Learning,Attentionbased Federated Learning,Experiments,Conclusions
Latex_files/full/expanded/181201571.tex,Introduction,Problem settings and network used,Training statistics,Simulation results,Connection with infinite lattice decoding
Latex_files/full/expanded/201005949.tex,Introduction,Materials and methods,Results,Discussion,Conclusions,Keypoint definitions,Batch size inspection,Transfer validity
Latex_files/full/expanded/210404696.tex,Introduction,Related Work,Preliminaries and Definitions,Approach,Implementation and Experimental Results,Discussion,Conclusions
Latex_files/full/expanded/201200012.tex,Introduction,Further Related Work,Task Formulation,Method,Evaluation,Discussion,Politeness Strategies,Prolific Annotators,Additional Details on ilp,Details on Human Evaluations,Additional Generation Examples
Latex_files/full/expanded/190905528.tex,Introduction,Related work, Modelabbreviation hightlightmodelname,Restaurant Search Task,Laptop Network Troubleshooting,Discussion,Conclusion,Dataset Supplemental Material,Parameters settings,Example,Introduction
Latex_files/full/expanded/180207091.tex
Latex_files/full/expanded/200803323.tex,Introduction,Datasets used in this study,Approach ,Experiments,Conclusions,Qualitative results,ASSEMENTEST,EXPERTTEST
Latex_files/full/expanded/151204036.tex,Introduction,Algorithm Overview,Augmented Bipartite Graph Construction,Tracking Idea Flows,Evaluation,Related Work,Conclusions and Future Work,Acknowledgements
Latex_files/full/expanded/201016228.tex,Introduction,Background,Methodology,Analysis of Religious Bias in Word Embeddings,Experiments and Results,Conclusion
Latex_files/full/expanded/210314804.tex,Introduction,Related Work,Methodology,Evaluation,Conclusion
Latex_files/full/expanded/210106811.tex,Introduction,Fairness,Utility,Optimal FairnessUtility Tradeoff,Numerical Experiments,Conclusions
Latex_files/full/expanded/151108280.tex,Introduction,Welfare and efficiency,Possible and necessary welfare,All possible policies,Balanced policies,Recursively balanced policies,Balanced alternating policies,Two agents,House allocation,Other related work,Conclusions
Latex_files/full/expanded/180704742.tex,Introduction,Related Work,Background,GoalConditioned Policies with Unsupervised Representation Learning,Experiments,Discussion and Future Work,Code,Acknowledgements,Complete Ablative Results,Hyperparameters,Environment Details
Latex_files/full/expanded/210306460.tex,Introduction,Background of Neural Network Pruning,Pruning at Initialization PaI,Summary and Open Problems,Conclusion
Latex_files/full/expanded/201212401.tex,Introduction,Problem Description and Related Work,Methodology,Results and Analysis,Conclusions and Future Work,Broader Impact
Latex_files/full/expanded/200414546.tex,Introduction,Approach,Related Work,Experiments,Conclusion,Amazon Reviews explanations,Human Study GUIs
Latex_files/full/expanded/190710882.tex,Introduction,Related Work,Semantic Bottleneck Networks for Interpretability and Inspection,Experiments,Discussion  Conclusion,Intro,Selection of concepts for Cityscapes,Implementation details  Clustering,Supplementary error examples
Latex_files/full/expanded/181006323.tex,Introduction,Related Works,Proposed Approach,Performance Evaluation,Conclusion
Latex_files/full/expanded/200301670.tex,Introduction,Explainable AI Basics,The EXPLAINIT Framework,EXPLAINIT for YouTube QoE,Concluding Remarks
Latex_files/full/expanded/13015022.tex,Introduction,Preliminaries,Reidentification algorithms,A formalization of reidentification,Conclusions
Latex_files/full/expanded/190408809.tex,Introduction,Background,Building a Dataset of Optimal Trajectories,Experiments,Results,Conclusions and Discussion,Appendix
Latex_files/full/expanded/181105852.tex,Introduction,Predicting the time evolution of multiphysics systems,Conclusions
Latex_files/full/expanded/190506214.tex,Introduction,Related Work,Problem Definition  Preliminary,GMNN Graph Markov Neural Network,Application,Experiment,Conclusion,Optimality Condition for qtheta,Additional Experiment
Latex_files/full/expanded/190100560.tex,Introduction,Related Work,Method,Experiments,Relationship to Other Approaches,Conclusion,Detailed Experimental Results
Latex_files/full/expanded/210501688.tex,Introduction,Related Work,Dataset,Data Transformations,Method,Evaluation Metrics,Evaluation of our Model,Discussion,Ethics Statement
Latex_files/full/expanded/200501291.tex,Introduction,Bayesian Optimization,User Study,Discussion and Conclusion
Latex_files/full/expanded/170702774.tex
Latex_files/full/expanded/211108817.tex,Introduction,Problem Description,Related Work,Methodology,Implementation Details,Results,Conclusion and Future Work
Latex_files/full/expanded/201002917.tex,Introduction,Related Work,Background,Noise Contrastive Priors NCPs,Conditional NCE for Hierarchical VAEs,NVAE Based Model and Context Feature,Implementation Details,Additional Examples  Nearest Neighbors from the Training Dataset,Additional Qualitative Examples,Additional Qualitative Examples,Additional Qualitative Examples,Experiment on Synthetic Data,Experiments,Conclusions,Impact Statement,Acknowledgements,Funding Transparency Statement,Training Energybased Priors using MCMC,Maximizing the Variational Bound from the Priors Perspective
Latex_files/full/expanded/170104906.tex,Introduction,Literature review,Data and Methodology,Results,Summary and discussion,Conclusions,Supplementary Methods
Latex_files/full/expanded/210607217.tex,Introduction,Related Works,Method,Experiments,Conclusion
Latex_files/full/expanded/13060842.tex,Introduction,Motivation Standard Kernel Mean Estimator Is Inadmissible,Kernel Mean Shrinkage Estimator,Experiments,Conclusions,JamesSteins Estimator,Kernel Mean Shrinkage Estimator,Proof of Theorem refthmakmseloocv,Shrinkage Centering in Feature Space,Covarianceoperator Shrinkage Estimator
Latex_files/full/expanded/200606830.tex,Introduction,Other Related Work,Graph Data Augmentation via Edge Manipulation,Proposed methodshared Framework,Evaluation,Conclusion,Proofs,Additional Dataset Details,Implementation Details  and Hyperparameter Tuning,Discussion and  Additional Experimental Results
Latex_files/full/expanded/171106623.tex,Introduction,Related Work,Learning Ephemerality Masks,EphemeralityAware Visual Odometry,Experimental Setup,Results,Conclusions,Acknowledgements
Latex_files/full/expanded/200308798.tex,Introduction,Related Work,Methodology,Experiments and Results,Discussions and Analysis,Conclusion
Latex_files/full/expanded/201204035.tex,Introduction,Related Work,Benchmarking Setup,Benchmarking Results,Conclusion,Acknowledgments,Resource Availability and Licensing,Broader Impact,Dataset Preparation,TaskSpecific Experimental Details,StateOfTheArt Methods,Supplementary Tables
Latex_files/full/expanded/180509822.tex,Introduction,Related work,Multilingual sentence embeddings,Experimental evaluation BUCC shared task on mining bitexts,Conclusion
Latex_files/full/expanded/201112651.tex,Introduction,Preliminaries,Data reduction,Results,Conclusion  outlook
Latex_files/full/expanded/190700758.tex,Introduction,Background,Model,Data,Experiments,Conclusion,Acknowledgements
Latex_files/full/expanded/191013003.tex,Introduction,Related Works,Neural Similarity Learning,Neural Similarity Networks,Theoretical Insights,Discussions,Applications,Concluding Remarks,Experimental Details,Local and Global Neural Similarity,Significance of NSL for MetaLearning
Latex_files/full/expanded/200404177.tex,Introduction,Data set,GAN architecture,Results and Discussion,Conclusion,Appendix A
Latex_files/full/expanded/160600925.tex
Latex_files/full/expanded/161101457.tex,Introduction,Previous work Deep Qlearning,Predictive Reinforcement Learning,Experiments,Discussion,Implementation details
Latex_files/full/expanded/190800286.tex,Introduction,Task Description,Related Work,Approach,Experimental Setup,Results,Discussion
Latex_files/full/expanded/210800080.tex,Introduction,Background and Related Work,Dataset,Methods,Results,Discussion,Dataset Visualizations,Further Results,Methodological Details
