Latex/200201768.tex,introduction,problem definition,datasets,machine learning method,result,discussion,acknowledgment
Latex/200110006.tex,introduction,variational optimization on lie group the general theory,the example of son and it application to leading gev,experiment
Latex/200202842.tex,introduction,background,method,experiment,conclusion and future direction
Latex/200111272.tex,introduction,fitness landscape,neuroevolution,experimental study,conclusion and future work
Latex/200204792.tex,introduction,preliminary,balanced multitask learning,experiment,conclusion
Latex/200106846.tex,introduction,syntax extension,collaborative parsing,compile sql to workflow,demo overview
Latex/200201441.tex,introduction,material and method,result,conclusion
Latex/200200423.tex,introduction,related work,the trail environment,patternbased formula embeddings,graphbased formula embeddings,evaluation,conclusion
Latex/200205856.tex,s3pr in computational optic,additional result
Latex/200105852.tex,introduction,background,proposed network tbcnet,loss function and training method,experiment,conclusion
Latex/200203735.tex,introduction,related work,problem definition,methodology,result and performance comparison,discussion and future work
Latex/200201776.tex,introduction,preliminary,mc is a uniquely robust abcc rule,a characterization for av,robustness of other abcc rule,discussion and open problem,appendix
Latex/200102037.tex,introduction,gilbert simondons philosophical concept used in computer model,allagmatic metamodel formulation,allagmatic metamodel implementation,simple experiment,conclusion and outlook
Latex/200204202.tex,introduction,related work,rationale generating algorithm,rga and chess,experimental design,result,discussion and conclusion
Latex/200106370.tex,introduction,activation function,function approximation,performance resultslabelsecperformanceresults,comparison with approxfnultrafastsigmoid,comparison with word2vec lookup table,approximation in tensorflow,threat to validity,conclusion
Latex/200203407.tex,introduction,related work,reflection summarization dataset,explored approach for limited resource,proposed templatebased synthesis model,experiment,result,conclusion and future work,acknowledgment
Latex/200104567.tex,introduction,a bayesian approach to seismicimaging,numerical experiment,discussion and conclusion
Latex/200202959.tex,introduction,related work,method,experiment,conclusion,acknowledgement,supplementary figure,inputdependent combining weight network,imagenet training,supplementary table
Latex/200105209.tex,introduction,related work,preliminary,seerl,experiment,conclusion and future work
Latex/200205183.tex,introduction,constrained statistical learning,the parameterization gap,the empirical gap,the empirical duality gap,numerical example,conclusion,proof of proposition2
Latex/200103715.tex,introduction,background and preliminary,reduced qubo formulation,concluding remark
Latex/200201626.tex,introduction,multichannel deep clustering,the proposed separation method,experiment and result,conclusion
Latex/200106838.tex,introduction,related work,statistic in batch normalization,moving average batch normalization,experiment,conclusion,sketch of proof,experiment
Latex/200101328.tex,introduction,background stochastic flow,sensitivity via stochastic adjoint,virtual brownian tree,latent stochastic differential equation,related work,experiment,discussion,appendix
Latex/200104437.tex,introduction,background,lpsparsemap,lpsparsemap loss for structured output,experiment,related work,conclusion,separable reformulation of lpsparsemap,derivation of update and comparison to lpmap,backward pas,specialized algorithm for common factor,experimental detail,code sample
Latex/200205873.tex,introduction,related work,proposed method,experiment,conclusion
Latex/200201169.tex,introduction,related work,graphical mutual information definition and maximization,experiment,conclusion
Latex/200104831.tex,contextualization,motivation,objective,research question,research scope,presentation order,recommender system background,news recommender system,item embeddings and 2vec model,deep collaborative filtering,deep sequencebased sessionbased and sessionaware r,deep feature extraction from heterogenous data,multiview learning for recommender system,the problem context,requirement,the proposed metaarchitecture,comparison with related work,the emphchameleon instantiation,baseline recommendation method,evaluation methodology,implementation,analyzing the importance of input feature for the emphnar module rq2,analyzing the effect of textual representation in recommendation rq3,reducing the item coldstart problem for news recommendation rq4,balancing accuracy and novelty with emphchameleon rq5,contribution,recommendation,suggestion for future work,the supervised acr module training method,the unsupervised acr module training method,architecture of deep learning,deep learning for nlp
Latex/200104066.tex,related work,proposed scheme,experiment,conclusion,introduction
Latex/200105343.tex,introduction,related work,imputed causal learning,experiment result,conclusion
Latex/200203438.tex,introduction,problem formulation and basic,limit theorem,discussion
Latex/200205283.tex,introduction,background and related work,proposed method,implicit regularization on hessian matrix,experiment,conclusion,appendix
Latex/200109001.tex,introduction,proposedmodel foundation and design,experimental detail,result,conclusion
Latex/200111091.tex,introduction,methodology,experiment and result,conclusion
Latex/200105573.tex,introduction,the ted explainability framework,ted with partial supervision,datasets and label synthesis,experiment,discussion and open problem,additional fico dataset detail,additional experimental detail and result
Latex/200105636.tex,introduction,background,mime,implementation,experiment,discussion and conclusion
Latex/200204375.tex,introduction,problem and existing solution,a generalized kernelbased algorithm,numerical simulation,conclusion
Latex/200102656.tex,introduction,a stochastic probabilistic program,inference in stochastic probabilistic program,implementation,case study,discussion,acknowledgement,source code for case study
Latex/200200372.tex,introduction,stateoftheart,methodology,experimental result,analysis and evaluation of result,conclusion
Latex/200100503.tex,introduction,related work,preliminary,method,experiment setup,result and discussion,future work,conclusion
Latex/200202025.tex,introduction,bayesian classification setup,optimal semisupervised classifier,optimal active learning policy,green informationtheoretic bound,simulation result,proof of theoremreftheooptquery,proof of theoremrefrenyiupperbound,proof of theoremrefrenyilowerbound,proof of theoremreftheolowermgaingeneral
Latex/200204289.tex,introduction,related work,background,experimental study,result,conclusion
Latex/200108016.tex,introduction,background,proposed approach,epistemic lie versus ontological lie,conclusion
Latex/200205545.tex,introduction,definition and assumption,algorithm,convergence analysis,sampling design and primaldual tradeoff,numerical experiment,conclusion,proof of theorem,proof of corollary
Latex/200202997.tex,introduction,related work,rena recursive nearest agglomeration,cluster in convolutional layer,dropcluster,experiment,conclusion
Latex/200107793.tex,introduction,related work,proposed algorithm,experiment,conclusion and future work,acknowledgement
Latex/200109523.tex,introduction,background,progressive growing of ambientgans,numerical study,result,conclusion
Latex/200101296.tex,introduction,the concept of diversity,random walk in heterogeneous information network,network diversity measure,application,conclusion
Latex/200100483.tex,introduction,sdimemphlogit,related work,experiment,conclusion,appendix
Latex/200110570.tex,introduction,data,user behavior analysis,methodology,result,related work,discussion,conclusion
Latex/200109725.tex,introduction,motivation,implementation issue,discussion,conclusion
Latex/200108853.tex,introduction,concept and problem definition,proposed method,experiment,related work,discussion on linear threshold,conclusion
Latex/200107861.tex,introduction,estimation of a,practical aspect of the algorithm,experimental result,conclusion,proof
Latex/200204827.tex,introduction,related work,background,approximating mmap by multiple mar,numerical experiment,conclusion and outlook
Latex/200203113.tex,introduction,learning preference from projective preferential feedback,sequential learning by projective preferential query,numerical experiment,user experiment,conclusion
Latex/200202868.tex,introduction,background and related work,proposed method,experiment,conclusion
Latex/200100501.tex,introduction,transformer speech recognition model,data set used for performing experiment,eeg feature extraction detail,eeg feature dimension reduction algorithm detail,result,conclusion and future work,acknowledgement
Latex/200111590.tex,introduction,related work,proposed crossover operator,proposed mechanism of combination two new crossover and mscx,computational result,conclusion
Latex/200109654.tex,introduction,preliminary,formulation of the problem and it complexity,our proposed algorithm,evaluation,related work,conclusion and future work
Latex/200110964.tex,introduction,related work,methodology,result and discussion,conclusion and future work
Latex/200108116.tex,introduction,background,related work,amortized qlearning,experiment,discussion
Latex/200204700.tex,introduction,method labelsecmethod,result,discussion
Latex/200108747.tex,introduction,related work,method,experiment,discussion,appendix
Latex/200102223.tex,introduction,related work,background,taskweighting method,result,conclusion
Latex/200102338.tex,introduction,background and motivation,problem,hypersched,system implementation,evaluation,discussion,conclusion,acknowledgement
Latex/200106081.tex,introduction,fourier classification algorithm,result,conclusion
Latex/200202836.tex,introduction,a simple example fuzzybear,background on causal reasoning,learning causally correct model,experiment,conclusion,backdoor and frontdoor adjustment formula,derivation of causal correctness for the model in creffigpartialmodelall,additional choice of the backdoor zt,algorithm for training and simulating from the model,discussion of model property,muzero property on stochastic environment,tree search experiment,dyna experiment on avoidfuzzybear,valueiteration analysis on mdps,detail for 3d experiment,model rollouts
Latex/200108247.tex,introduction,related work,methodology,experiment,conclusion
Latex/200100994.tex,problem specification,design consideration,robustness
Latex/200102114.tex,introduction,related work,experiment 2 effect of local explanation,discussion,limitation
Latex/200102773.tex,introduction,preliminary,proposed approach,experiment,discussion
Latex/200202741.tex,introduction,background,related work,threat model,methodology,experiment and result,discussion and conclusion,acknowledgment
Latex/200106270.tex,introduction,model representation,bayesian analysis,optimization with known model error statistic,full joint optimization with expectationmaximization,numerical illustration,conclusion
Latex/200203722.tex,introduction,convergence speed of gradient estimate,convergence speed of the jacobian,consequence on optimization,experiment,experiment detail and extra experiment,proof for autorefsecthm,proof autorefsecjaco,proof of autorefpropinexactsgd
Latex/200111595.tex,problem formulation,theoretical analysis the asymptotic case,proof for the asymptotic scenario
Latex/200202998.tex,introduction,background,motivation,methodology,experiment,conclusion
Latex/200104171.tex,introduction,subdivision of fusion technique,fusion technique of the particular level,conclusion
Latex/200105851.tex,introduction,the frpn model,cfrpn,experimentation,conclusion
Latex/200203329.tex,introduction,contribution,existing model of stochastic gradient,e in the nonconvex world,sgd in the nonconvex world,importance sampling and optimal minibatch size,experiment,basic fact and notation,relation between assumption,proof for sectionrefsecsubsampling and refseccompression,proof for general smooth objective,proof under assumptionrefasmplcondition,proof under assumptionrefasmquadraticfunctionalgrowth,experimental detail
Latex/200104528.tex,introduction,related work,overview,on demand evaluation enabled cnn generator,training,result,limitation and future work,conclusion
Latex/200109239.tex,introduction,selfsupervised learning with pase,corpus and asr setup,result,conclusion,acknowledgement
Latex/200104786.tex,introduction,problem and data model,balancing communication and computation in distributed learning,practical issue and numerical result,conclusion open problem,acknowledgement
Latex/200109521.tex,introduction,related work,method,result and discussion,conclusion
Latex/200106202.tex,introduction,application description,us of ai technology,application use and payoff,application development and deployment,maintenance,conclusion and future work,acknowledgment
Latex/200201849.tex,introduction,the textttr2rils algorithm,numerical result,theoretical analysis,proof of theoremrefthmnoisy,proof of auxiliary lemma reflemminnormsolgeneralx
Latex/200107437.tex,introduction,related work,problem formulation of wsol,evaluation protocol for wsol,experiment,discussion and conclusion,problem formulation of wsol,evaluation protocol for wsol,experiment
Latex/200202208.tex,introduction,frank wolfe on one hidden layer network,stochastic frank wolfe,hidden convexity,numerical result
Latex/200203244.tex,introduction,related work,proposed approach rationalerl,experiment,conclusion
Latex/200104676.tex,introduction,background,proposed algorithm,theoretical result,experiment,conclusion,a review of multilevel monte carlo method,comparison of nmc sumo and mlmc,proof of theorem 2 and 3,bayesian treatment of parameter,experiment using locally marginalised elbo
Latex/200100051.tex,introduction,related work,data set,multilabel classification with postprocessing,experiment,conclusion and future work
Latex/200104032.tex,introduction,related work,background,predictionconstrained pomdps,simulated environment,real data application hypotension,discussion,additional detail on pointbased value iteration,additional detail on learning reward,additional setup detail and result for tiger domain,additional setup detail for sepsis domain,additional setup detail and result from mimic icu hypotension domain
Latex/200201587.tex,introduction,deep learning tube,three way to learn tube for tube mpc,experimental detail,conclusion
Latex/200205193.tex,quantitative versus qualitative analysis,probabilitybased modeling,prediction and explanation,assessing model performance,summary and conclusion
Latex/200108665.tex
Latex/200204725.tex,introduction,related work,preliminary,classification,regression,conclusion,proof of crefthmgaussian,proof of crefthmbernoulli,proof of crefobregressionwstdwrob,proof of crefobregressiongn,test loss of standard and robust model
Latex/200200841.tex,introduction,problem formulation,cube2net,experimental evaluation,related work,conclusion
Latex/200109528.tex,architecture and approach,experiment and result,discussion,conclusion,author contribution,acknowledgment,appendix
Latex/200200287.tex,introduction,preliminary,algorithm and main result,analysis,discussion,proof of lemmarefexp2base,proof of lemmarefquadratic,algorithm for contextual learning with full information,efficient implementation of mgr
Latex/200104589.tex,introduction,ngram selfattention,experiment,related work,conclusion and future work
Latex/200107754.tex,introduction,preliminary,elutoel approximation,alctoelbot approximation,approximation and query evaluation,conclusion,proof of theoremrefthmdecidable,proof of theoremrefthmcorr,proof of theoremrefthmsmallercomplete,proof of theoremrefthmacyclicbetter,proof of theoremsrefthmcorrbot andrefthmcorrminus,more optimization for figurereffigthird,proof of theoremrefthmomqresults
Latex/200108481.tex,introduction,related work,method description,experiment,conclusion
Latex/200203214.tex,introduction,system model and iterative acsic,deepacsic,numerical study,conclusion
Latex/200205131.tex,introduction,game rule,main result,open problem
Latex/200110789.tex,introduction,related work,learning pointbased localisation,experimental setup,result,conclusion,acknowledgment
Latex/200200737.tex,introduction,related work,motivation,proposed method,experiment,further analysis,conclusion and future work,appendix
Latex/200202883.tex,introduction,related work,methodology,experiment and result,discussion,conclusion
Latex/200202826.tex,introduction,related work,background,conditional dgp and multifidelity kernel learning,method,result,discussion,conclusion
Latex/200202618.tex,introduction,related work,neuralnetwork quantum state,finding the quantum critical point,performance evaluation,conclusion,evaluation of innate restricted boltzmann machine neuralnetwork quantum state for twodimensional system,evaluation of innate restricted boltzmann machine neuralnetwork quantum state for threedimensional system,analysis of the order parameter for a system of a given size with tensor network method,analysis of the order parameter for a system of a given size for two dimensional system,analysis of the order parameter for a system of a given size for three dimensional system,effectiveness of finding the inflection point for a system of a given size for correlation order parameter,effectiveness of finding the inflection point at the limit of infinite size for correlation order parameter
Latex/200103000.tex,motivation,related work,general reuse,algorithmspecific reuse,insight and proof of concept for increasing data reuse,conclusion,acknowledgement
Latex/200106858.tex,introduction,problem formulation and review of rbfs,general global optimization framework,simulation study,simulation study for three and four dimension,discussion,conclusion and future work
Latex/200107038.tex,introduction,background,diversity index for ai conference,index evaluation,conclusion
Latex/200102652.tex,introduction,background,algorithm,experimental result,conclusion
Latex/200108539.tex,introduction,related work,notation,approach,experiment,conclusion
Latex/200103671.tex,introduction,formatting your paper,final copy
Latex/200102658.tex,introduction,supervised deep learning with distributionally robust optimization,hardness weighted sampling for distributionally robust deep learning,experiment,discussion,conclusion,statement of broader impact,more on our experiment,summary of the notation used in the proof,proof,proof of theoremrefthconvergencedro convergence of sgd with hardness weighted sampling for overparameterized deep neural network with relu
Latex/200101678.tex,introduction,learning via a lowdimensional driftdiffusion dynamic in sgd,the loss function landscape and the inverse varianceflatness relation,the random landscape theory and origin of the inverse varianceflatness relation,preventing catastrophic forgetting by using landscapedependent constraint,sgd a a selftuned landscapedependent annealing strategy for learning,method,acknowledgment
Latex/200107831.tex,introduction,from predictive modeling to predictive control,building,model predictive control with neural network,experiment,conclusion and future work,floor level layout of the building,data acquisition
Latex/200105401.tex,introduction,multitask squareroot lasso,multivariate squareroot lasso,experiment,technical lemma,concentration inequality,single task case
Latex/200200169.tex,related work,deep multiview enhancement hashing,experiment,conclusion,introduction
Latex/200202176.tex,introduction,related work,methodology,evaluation,summary
Latex/200204193.tex,introduction,related work,model i embedding f and composition g,model ii embedding f and query h,model iii supervised ftextrmim ftextrmlabel h,conclusion
Latex/200102539.tex,introduction,system formulation,model and method,result,conclusion,neural architecture of agentnet and training detail,dataset detail,advantage of neural attention,aoup attention analysis
Latex/200201927.tex,supplementary table and figure,theory on convergence
Latex/200103674.tex,introduction,method,datasets,result,conclusion and future work
Latex/200204219.tex,introduction,related work,proposed approach,datasets and experiment,conclusion
Latex/200109187.tex,introduction,error analysis,lowrank approximation of the covariance operator,isotropic covariance kernel,numerical experiment,conclusion
Latex/200110866.tex,introduction,ease of use,prepare your paper before styling
Latex/200112010.tex,introduction,overview,analyzing the deep analysis dictionary model,learning a deep analysis dictionary model,simulation result,conclusion
Latex/200107853.tex,introduction,problem statement,algorithm and guarantee,simulation,conclusion
Latex/200107199.tex
Latex/200104001.tex,introduction,from linear to nonlinear dimensionality reduction,a deep learningbased reduced order model dlrom,numerical result,conclusion,basic concept of deep learning
Latex/200105494.tex,introduction,background,music adversarial autoencoder musae,experimental analysis,discussion and concluding remark
Latex/200200072.tex,introduction,related work,proposed method,experimental setup,result and discussion,conclusion
Latex/200107526.tex,introduction,schemaguided approach to dst,domainaware dialogue state tracker,experiment,result and discussion,conclusion
Latex/200204764.tex,introduction,capsule network architecture,inverted dotproduct attention routing,inference and learning,experiment on diversemultimnist,related work,conclusion and future work,model configuration for diversemultimnist,parameter initialization in capsule,connection between standard neural network and capsnets
Latex/200105424.tex,introduction,motivating scenario,scout architecture and implementation,evaluation,related work,discussion and conclusion
Latex/200202390.tex,introduction and related work,assumption definition and notation,deterministic perturbation,stochastic perturbation,useful inequality about packing and covering number,texorpdfstringsimple bound on d nearoptimality dimensionsimple bound on the nearoptimality dimension,proof of corollariesrefcorpiyanytime andrefcorepspi
Latex/200104484.tex,introduction,experimental setup,experimental result,conclusion
Latex/200205474.tex,introduction,related work,model and preliminary,achieving no regret simultaneously,generalization,conclusion,acknowledgement,omitted detail from section refsecnoregret,omitted detail from section refsecgen
Latex/200100819.tex,introduction,basic concept,result,lower bound on the size of specific formula,irredundant pc and urc formula,characterization of pc formula,urc encoding of a qhorn formula,conclusion and further research
Latex/200111951.tex,introduction,introduction and related work,developed cnn architecture,experimental setup,result and analysis,conclusion
Latex/200202664.tex,introduction,labelsecnumericsnumerical result,labelsecdiscussionconclusions and discussion
Latex/200204076.tex,introduction,dataset,methodology,relation to prior work
Latex/200201406.tex,introduction,background,main result,conclusion and discussion
Latex/200104271.tex,introduction,related work,methodology,experimental result,discussion,conclusion,acknowledgement
Latex/200200801.tex,introduction,background,coolname inference,implementation spflow integration,experimental evaluation,conclusion
Latex/200101408.tex,introduction,background,conditional graph logic network,model design,mle with efficient inference,experiment,discussion,connection to markov logic network,detail of setup,more experiment result
Latex/200201060.tex,introduction,model,fault detection and model transfer,result,conclusion
Latex/200108335.tex,introduction,technical preliminary,example modelling of concurrent multiagent negotiation,conclusion
Latex/200101871.tex,introduction,methodology,experiment and result,skill composition,related work,conclusion,appendix
Latex/200107155.tex,introduction,cluster analysis and knowledge transfer,numerical experiment,concluding remark
Latex/200108647.tex,introduction,referencing source code for reproducibility,identifier system and their property,data model,software heritage identifier,validation,showcase,conclusion
Latex/200104958.tex,introduction,related work,problem statement,background,differentially private and fair classification,performance evaluation,conclusion,acknowledgment
Latex/200108806.tex,introduction,background,related work,motivation,the proposed scheme,methodology,evaluated result,conclusion
Latex/200108374.tex,introduction,the joint scoring function and escaviar framework,the lstmal model,simulation study,empirical study,conclusion
Latex/200102469.tex,introduction,material and method,result and discussion,conclusion and outlook
Latex/200111297.tex,introduction,model,experimental evaluation,related work,conclusion
Latex/200104362.tex,introduction,related work,domain distance measure,model,experimental setup,analysis of distance measure,distancenet and bandit result,conclusion
Latex/200100550.tex,preliminary,proof of proposition 2,variance of the cost function partial derivative,variance of the cost function partial derivative for a single layer of the alternating layered ansatz,proof of theorem 2,proof of corollary,faithfulness of local cost function for quantum autoencoder
Latex/200201687.tex,introduction,learning embeddings,datasets,experiment,result,conclusion
Latex/200203773.tex,introduction,introduction,visual emotionsentiment analysis concept and background,visual sentiment analysis of disaster a usecase,summary conclusion and future research direction
