Latex/200201768.tex,introduction,problem definition,datasets,machine learning method,result,discussion,acknowledgment
Latex/200100463.tex,introduction,text generation and the computer security analogy,existing literature the offensedefense balance,a framework for weighing security cost and benefit of disclosure,contrasting different field,applying the framework to ai,conclusion,goldilocks zone,generalising to unintended harm,assessing strand of research rather than individual paper
Latex/200106961.tex,introduction,related work,proposed method,result and discussion,conclusion and future work
Latex/200204328.tex,introduction,notation and preliminary,tensor regression,simulation study,empirical application,conclusion
Latex/200108300.tex,introduction,related work,system model and definition,data selection,experimentation result,conclusion
Latex/200110065.tex,introduction,related work,background,robust recurrent neural network for medication prediction,experiment,conclusion and future work
Latex/200106472.tex,introduction and main result,quadratic loss function for one parameter damped harmonic oscillator and optimal superacceleration,higherdimensional example labelsechighd,mnist classification with neural network labelsecnnmnistclassification,combining with adaptive method rmsprop,discussion context and recommendation
Latex/200202528.tex,introduction,setup and preliminary,generalized resnet gresnet modeling,numerical example,conclusion
Latex/200109734.tex,introductionlabelsecchap07intro,background and related worklabelsecchap07relatedwork,interactively customisable explanationslabelsecchap07glassbox,discussionlabelsecchap07discussion,summary and conclusion
Latex/200202862.tex,introduction,notation background and theory,a unified framework for implicitly deep generative modeling,related work,experiment,conclusion and future work,appendix,experimental detail
Latex/200205063.tex,introduction,basic concept,elicitation by logical compatibility,adaptive approach,adding property,elicitating dependency between property,learning from data,experiment,conclusion
Latex/200102328.tex,introduction,background the problem of imitation learning,pomerleaus autonomous driving paper,abbeels inverse reinforcement learning paper,ho gail paper,ghasemipours divergence minimization perspective paper,conclusion and future outlook
Latex/200203559.tex,introduction,proposed model,experiment,result and discussion
Latex/200205373.tex,introduction,problem formulation decentralized empirical risk minimization,decentralized stochastic optimization,decentralized variancereduced method with gradient tracking,numerical illustration,extension and discussion,conclusion
Latex/200205271.tex,introduction,related work,conceptbased testing of ml model,statistical and logical reasoning of hypothesis,visual analysis of hypothesis,result and discussion,conclusion
Latex/200104056.tex,introduction,background and threat model,acceptance region and proposed attack,evaluation on biometric system,synthetic dataset,mitigation,discussion,related work,conclusion,acknowledgment,mitigation roc plot,dnn estimator configuration
Latex/200100236.tex,introduction,dataset,methodology,experiment and result,conclusion
Latex/200201365.tex,introduction,background,neural iterated learning model,experiment and discussion,discussion a parallel with language evolution,conclusion
Latex/200104893.tex,introduction,related work,scenario,sysname overview,experiment,concluding remark
Latex/200108973.tex,introduction,consistency for texorpdfstringlnln,convergence proof,numerical experiment,conclusion,a more general operator,definition of viscosity solution,setup and main result
Latex/200204663.tex,introduction,related work,problem setup,tdefsi,experiment,concluding remark and direction for future work,appendix
Latex/200201621.tex,introduction,related work and preliminary,an illustrative example,the fairnessutility space,fairnessutility policy elicitation,preferenceconstrained model optimization,future work,conclusion
Latex/200108434.tex,introduction,literature review,proposed approach,experimental setup,result,discussion,conclusion
Latex/200111482.tex,introduction,continuous speech separation,libricss,experimental result,conclusion
Latex/200109621.tex,introduction,problem definition,methodology,experiment,limitation,related work,conclusion,optimized graph matching consensus algorithm,proof for theorem 2,comparison to the graduated assignment algorithm,robustness towards node addition or removal,related work i,related work ii,dataset statistic,qualitative keypoint matching result
Latex/200104527.tex,introduction,problem formulation,methodology,result,conclusion
Latex/200103814.tex,introduction,overview of related work,selective protection scheme by deep reinforcement learning,experimental evaluation and analysis,conclusion
Latex/200108073.tex,introduction,related work,method,experiment,conclusion
Latex/200104030.tex,introduction,related work,system model,federated semisupervised learning,numerical result,conclusion
Latex/200104756.tex,introduction,related work,federated learning using sparse gradient,online learning to determine k,experimentation result,conclusion
Latex/200203736.tex,introduction,method,experiment,conclusion and future work
Latex/200201222.tex
Latex/200106471.tex,introduction,firstorder and local combinatorial search algorithm,mixed integer programming algorithm,statistical property error bound,experiment,conclusion,proof and technical detail,additional experiment
Latex/200200509.tex,introduction,related work,machine consciousness correlated process,an unified architecture for the model,conclusion and further work
Latex/200104634.tex,introduction motivation,method,experiment,result,conclusion
Latex/200104345.tex,introduction,background and related work,datasets,model architecture training procedure,shareable embedding experiment result,inference consideration,conclusion future work
Latex/200201107.tex,introduction,proposed method,experiment,conclusion
Latex/200201891.tex,introduction,material and method,result,discussion
Latex/200105992.tex,introduction,related work,preliminary,efficient convergence using orthogonal initialization,exponential curse of gaussian initialization,experiment,conclusion,proof for secrefsecortho,proof for secrefsecgaussian
Latex/200205120.tex,introduction,background,parameterizing bb search tree,experiment,related work,conclusion and future direction,dataset curation,handcrafted input feature,solver setting and hardware,data augmentation,il optimization dynamic
Latex/200105390.tex,introduction,preliminary on description logic,semantic encoding of data usage policy,reasoning with pl,supporting general vocabulary,experimental assessment,conclusion
Latex/200201093.tex,introduction,related work,method,environment implementation detail,do supervised learning before selfplay,exploring variant of s2p,discussion,hyperparameters,calculation of optimal sample complexity in or game,additional plot
Latex/200202770.tex,introduction,basic of causal inference,causal inference method relying on three assumption,method relaxing three assumption,guideline about experiment,application,conclusion
Latex/200202305.tex,introduction,chemical potential data from atomic level model,integrable deep neural network,active learning workflow,elasticity,phase field formulation,implementation and result,conclusion,acknowledgement,idnn architecture and optimizer comparison
Latex/200104045.tex,failure rate and the poisson process,hypothesis testing closed form expression for false positivenegative trade off,breaking the test,mixed poisson process starring the negative binomial,result and application,hazard rate,using the exponential distribution to estimate average rate
Latex/200201547.tex
Latex/200202000.tex,introduction,objective alignment and fel,method,result,discussion,conclusion
Latex/200100561.tex,related work,proposed method,experimental result,conclusion,introduction
Latex/200108817.tex,introduction,method,experiment,conclusion
Latex/200203273.tex,introduction,setup,approach for minimizing finite sum,a biased estimator with quantization,application to stochastic oracle,discussion and future work,supplementary material
Latex/200205150.tex,introduction,material and method,result,related work,conclusion,acknowledgment
Latex/200111976.tex,introduction,related work,proposed approach,datasets,experiment and result,conclusion
Latex/200200901.tex,introduction,model formulation,inference,related work,evaluation,conclusion
Latex/200205645.tex,introduction,proposed algorithm,experimental result,conclusion,related work
Latex/200111363.tex,introduction,related work,method noiserobust efficient model,experiment,conclusion,acknowledgment
Latex/200101958.tex,introduction,principal component analysis pca,kernel principal component analysis,kpca backward mapping from zzstar to xxstar,numerical test,three vector product rule,the first d column of vv are equal to bb
Latex/200111854.tex,introduction,preliminary,placeholderframework,estimator for cryptographic primitive,numerical experiment and parameter instantiation,conclusion
Latex/200109127.tex,labelsec2 material and method,labelsec3 result,labelsec4 discussion,labelsec5 conclusion,supplementary material
Latex/200101588.tex,introduction,background,methodology,experiment,conclusion and future work
Latex/200204254.tex,introduction,setting,lower bound,definition of a test and privacy mechanism,adaptive test,discussion,proof of the result
Latex/200105862.tex,introduction,material and method,result,discussion
Latex/200102970.tex,introduction,the learning platform,closed loop dynamic,towards closed loop error backpropagation,the inner working of the learning unit,result,discussion
Latex/200108746.tex
Latex/200101006.tex,introduction,data preprocessing,clustering method for singlecell rnaseq,experimental evaluation for clustering method,discussion and conclusion
Latex/200203688.tex,introduction,building an ensemble,data preprocessing and augmentation,knowledge distillation,result
Latex/200103897.tex,basic,primary section,special environment,obtaining style file,conclusion,primary section
Latex/200106944.tex,introduction,background,distributional semantic matching,nestedwasserstein selfimitation learning,related work,experiment,conclusion,more detail about wsil,implementation detail,experimental setup,generated sample of unconditional text generation,generated sample of image captioning
Latex/200109947.tex,introduction,related work,proposed deep learning pipeline for near realtime map generation,methodology dataset acquisition and labelling,classification result and realtime map building,conclusion
Latex/200108277.tex,introduction,related work,preliminary,method and analysis,evaluation,conclusion and future work,general lemma,proof for prlc,proof for pr
Latex/200108366.tex,introduction,related work,continual local replacement,experiment,conclusion
Latex/200109136.tex,introduction and related work,proposed network design,experimental setup,experimental result,conclusion,appendix
Latex/200105137.tex,introduction,related work,proposed work,result and discussion,conclusion and future work
Latex/200205432.tex,introduction,method,discussion,conclusion
Latex/200100081.tex,introduction,background,methodology,finding,discussion,conclusion,questionnaire select question
Latex/200106509.tex,introduction,related work,study 2 increasing trust via transparency feature,study 3 eliciting information need,discussion,conclusion
Latex/200107342.tex,introduction,related work,proposed method,result and conclusion,future work
Latex/200201053.tex,introduction,problem formulation,blind deconvolution via deepurl,experiment,conclusion
Latex/200109365.tex,introduction,preliminary,knowledge expansion and contraction framework,modelbased approach to evolution,formulabased approach to kb evolution,formulabased approach to abox evolution,related work,conclusion and future work
Latex/200203864.tex,introduction,related work,mapper for visualisation,mapper for pooling,experiment,conclusion and future work
Latex/200103992.tex,introduction,related work,methodology,datasets,result,conclusion
Latex/200200848.tex,introduction,related work,proposed method,experiment,conclusion,acknowledgment,acknowledgment,template overview,modification,typeface,title information,author and affiliation,right information,cc concept and userdefined keywords,sectioning command,table,math equation,figure,citation and bibliography,research method,online resource,appendix
Latex/200101781.tex,introduction,fuzzy number,fuzzy number a truth assignment and their truth and knowledge ordering,preorderbased triangle for mathscrt,answer set programming using mathscrt a set of truth value,conclusion
Latex/200107541.tex,introduction,provenance for elhr,reasoning with annotated elhr ontology,computing relevant provenance variable,query answering with provenance,discussion and conclusion
Latex/200105970.tex,introduction,related work,dataset,methodology,experimental result,conclusion
Latex/200107553.tex
Latex/200111113.tex,introduction,background,problem with gendice,gradientdice,experiment,related work,conclusion,proof,computational detail of the hard example for gendice,detail of experiment
Latex/200101331.tex,introduction,background,genetic programming for manifold learning using a multiobjective approach gpmalmo,experiment design,result,further analysis,conclusion
Latex/200205189.tex,introduction,related work,approach,experiment,conclusion,pseudocode,derivation of eqnrefeqgradient,additional environment detail,impact of coefficient lambda
Latex/200103041.tex,introduction,related work,dataset description,evaluation
Latex/200203218.tex,introduction,preliminary,conservative exploration in rl,conservative ucrl,experiment,conclusion,policy evaluation with uncertainty,regret bound for cucrl,conservative exploration in finite horizon markov decision process,experiment
Latex/200203639.tex,introduction,related study,preliminary,proposed method based on weighted deng entropy,application of fault diagnosis method,conclusion
Latex/200105559.tex,training rbms with mcmc,mode informed weight update,result,conclusion,sampling with memcomputing,stability of modeassisted training,efficient sampling of multimodal distribution,defining modal correspondence,showing modal correspondence
Latex/200201281.tex,introduction,image reconstruction with gan in related work,proposed approach,experiment,experimental result,detail of the datasets,detailed deep architecture,domainspecific metric for underground soil generation,additional sample from the texture and subsurface datasets
Latex/200202089.tex,introduction,related work,preliminary,methodology,experiment,conclusion
Latex/200205058.tex,introduction,related work,methodology,experiment,discussion and conclusion
Latex/200101793.tex,introduction,algorithm,application to nuclear fusion,acknowledgement
Latex/200110876.tex,introduction,related work,knowledge distillation,hardware resource and network requirement,embedded programming,result,conclusion
Latex/200203155.tex,introduction,related work,background and notation,main result,experiment,conclusion,experimental setup,more discussion on assumption,proof
Latex/200108001.tex,introduction,related work,definition,safety concern,potential mitigation approach,conclusion
Latex/200104601.tex,introduction,methodology,implementation and result,conclusion
Latex/200105948.tex,introduction,data,calibration method and forecast evaluation,result,discussion
Latex/200204187.tex,background,proposed lower bounding distance of dtw,similarity search under dynamic time warping,experimental evaluation,conclusion and future work,introduction
Latex/200101673.tex,introduction,background,method,result,discussion,conclusion
Latex/200103554.tex,related work,approach,experimental study,conclusion,supplementary material,introduction
Latex/200202369.tex,supplementary material
Latex/200111716.tex,introduction,data based psf modelling method for wfsats,application of the dae based psf model,conclusion and future work
Latex/200106814.tex,introduction,related work,problem setup,algorithmic approach,theoretical analysis,experiment,discussion
Latex/200109390.tex,introduction,mab with markovian regime switching,the seeu algorithm,regret bound,numerical experiment,analysis proof sketch for theorem refthmupperbound,conclusion and open question,constant in proposition refpropspectral,proof of proposition refpropspanunibound,proof of theorem refthmupperbound,proof of proposition refproplipbt
Latex/200109233.tex,introduction,problem and approach,ml modeling result,bias and fairness,predictive fairness,discussion
Latex/200200260.tex,introduction,finitetime analysis of stochastic approximation,application to qlearning,convergence proof,proof of auxiliary proposition in sectionrefsecsa and sectionrefsecq,proof of auxiliary lemma in sectionrefsecconvergence
Latex/200104835.tex,introduction,problem domain in artificial intelligence,overview graph and network representation,application of knowledge representation technique in robotics,conclusion and outlook,deep learning,collaborative knowledge,stand der technik,luftschlosser,suchmaschinen
Latex/200109977.tex,introduction,evaluating chatbots,meena chatbot,result,further advancing ssa,related work,discussion,additional sample conversation,additional sample response,additional figure
Latex/200203147.tex,introduction,preliminary,test adequacy,test generation,runtime monitoring,future work
Latex/200202400.tex,introduction,system model,targeted whitebox adversarial attack using channel information,nontargeted whitebox adversarial attack using channel information,whitebox adversarial attack with limited channel information,universal adversarial attack,simulation result,conclusion
Latex/200103560.tex
Latex/200103438.tex,introduction,datadriven material modelling framework,machine learning ml based hyperelasticity,data collection strategy for plasticity,machine learning based plasticity,conclusion
Latex/200202090.tex,introduction,related work,federated averaging algorithm,new federated momentum algorithm,experiment,conclusion
Latex/200204911.tex,introduction,related work,implicit surface estimation a gaussian process regression,sparse pseudoinput gaussian process and streaming data,online map learning with an ensemble of sparse gp expert,experimental result,conclusion,baseline comparison
Latex/200105070.tex,introduction,related work,notation and preliminary,cnns with ournn compressibility and generalization,experiment,conclusion and discussion,additional experimental result,common definition and proposition,cp layer in tensorial neural network,convolutional neural network compressibility and generalization,fully connected network compressibility and generalization,neural network with skip connection,additional algorithm and algorithmic detail
Latex/200203425.tex,introduction,literature review,the cyclic boosting algorithm,example demand forecasting,discussion causality,conclusion
Latex/200108255.tex,introduction,probabilistic modeling of driver behavior,evaluation,conclusion
Latex/200201793.tex,introduction,previous work,problem formulation,proximity preserving code,signed graph mincut problem,experiment and result,conclusion,appendix
Latex/200200994.tex
Latex/200205123.tex,introduction,related work,flickering adversarial attack,experiment on i3d,additional model baseline comparison and transferability,overtheair real world demonstration,conclusion and futurework,modified adversarial loss function,implementation detail,single video attack,additional model baseline comparison and transferability,overtheair real world demonstration
Latex/200203797.tex,introduction,framework design consideration,implementation and evaluation,discussion,conclusion
Latex/200109360.tex,introduction,main idea and technique,algorithm and hardness result,experimental result,conclusion
Latex/200201088.tex,introduction,acquisition of generalized skill via relaxed selection,from learning to inheritance the baldwin effect,research potential,challenge
Latex/200202846.tex,introduction,related work,background,the convergence of icf,kernel kmeans clustering using incomplete cholesky factorization,experiment,conclusion
Latex/200101391.tex,introduction,rulebased system,model criminological root,datasets,analytical process,vipar measure,structural cooffending variable,summary of the measure,result,discussion and conclusion
Latex/200102786.tex,introduction,lowrank binary quantization,scaled binary quantization,training binary network,experiment,conclusion,least square 2bits binary quantization,detail of training resnet on imagenet
Latex/200111314.tex,introduction,related work,proposed framework,experiment,conclusion,appendix
Latex/200105887.tex,introduction,related work,mixpath a unified approach,experiment,conclusion,proof,algorithm,experiment detail
Latex/200107093.tex,introduction,related work,barnet,experiment,conclusion
Latex/200103076.tex,introduction,related work,methodology,experiment,conclusion and future work,acknowledgement
Latex/200204090.tex,introduction,background and preliminary,policy gradient and optimization landscape,main convergence result,simulation result,conclusion
Latex/200104828.tex,introduction,system architecture and problem statement,entity type tagging,table answer selection,snippet generation,experimental evaluation,related work,conclusion
Latex/200205643.tex,introduction,proposed method,material,implementation,result and discussion,conclusion
Latex/200204108.tex,electronic submission,format of the paper,do emphnot have an appendix here
Latex/200107798.tex,introduction,related work,pretraining in imitation learning,our method,experiment,conclusion,acknowledgement,appendix
Latex/200105028.tex,introduction,existing unsupervised poolbased alr approach,ird,experiment and result,conclusion
Latex/200110996.tex,introduction,the setup and two impossibility result,the fucb policy in the presence of covariates,conclusion,auxiliary result,proof of result in sectionrefsecsetupx,proof of result in sectionrefsecfucbx
Latex/200100279.tex,introduction,supernova waveform,data set,wavelet detection filter,deep learning pipeline,search and classification result,discussion
Latex/200202892.tex,introduction,framework and notation,from spectral clustering to spectral norm concentration,spectral concentration of the adjacency matrix,spectral concentration of the normalized laplacian,proof,conclusion and outlook,proof
Latex/200106892.tex,introduction,preliminary,teacherstudent framework for classification,training with surrogate loss,discussion and future direction,appendix
Latex/200110883.tex,introduction,unsupervised anomaly detection,related work,experiment,conclusion
Latex/200205233.tex,introduction,connectivitydriven communication,experimental result,conclusion,ethical statement,heat kernel additional detail,pseudocode,additional result,ablation study,choosing the heat kernel threshold,varying the number of agent,environment detail
Latex/200202885.tex,introduction,background,implementation,profiling model packing,textttpackaware hyperparameter tuning,related work,discussion,conclusion and future work
Latex/200108049.tex,introduction,related work,problem description,algorithm,experimental result and discussion,conclusion,additional material for the experiment,outofdistribution detection
Latex/200100254.tex,related work,gradient norm equality,analysis of spectrummoments,serial neural network,serialparallel hybrid network,experiment,conclusion,proof,discussion,introduction,detailed setup of experiment
Latex/200205274.tex,introduction,related work,rethinking missinglabel object detection,proposed method,experiment and analysis,conclusion
Latex/200109773.tex,introduction,two methodology ideal textitvs nonideal,work on algorithmic fairness a smallscale ideal theorizing,trouble with ideal fairness metric,discussion,conclusion
Latex/200108523.tex,introduction,motivation,residual learning,pelican,evaluation,background,conclusion
Latex/200204613.tex,introduction,our approach,numerical experiment,discussion,stochastic reconfiguration,detail of numerical experiment,comparison of phase structure ansatze,average sign in exact diagonalisation,kernel of the ground state phase structure
Latex/200204137.tex,introduction,background and motivation,information theoretic analysis,efficient algorithm,experiment,related work,conclusion,supplementary material
Latex/200109309.tex,introduction,textitprobing by output layer,duplicating layer in downstream task,conclusion and future work,probing by output layer result on other datasets,duplicating layer result on sst2,statistic of datasets
Latex/200110122.tex,introduction,problem formulation,an auxiliary singleagent lq problem,main result,key step in the proof of theorem refthmregretboundcase2,experiment,conclusion,notation,preliminary,proof of theorem refthmregretboundcase2,proof of lemma reflemsigmaconvergence,proof of lemma refthmprobregret,detailed description of the textttsarl learner mathcall,optimal strategy for the optimal multiagent lq problem and the optimal singleagent lq problem,detail of experiment,proof of theorem reflemregretboundextension
Latex/200206053.tex,introduction,biochemical language processing,future perspective
Latex/200103923.tex,introduction,pathologyaware ganbased image augmentation,method,result,conclusion
Latex/200201965.tex,introduction,preliminary,problem formulation,method,result,conclusion
Latex/200102728.tex,introduction,related work,denoising density estimator ddes,learning generative model using ddes,experiment,conclusion
Latex/200202651.tex,introduction,related work,regularization for convolutional block,experiment,conclusion,acknowledgment
