Latex/200201768.tex,introduction,problem definition,datasets,machine learning method,result,discussion,acknowledgment
Latex/200105205.tex,introduction,preliminary,assumption on the distribution and activation are necessary,under mild assumption the gradient point in a good direction,convergence with constant probability under mild assumption,highprobability convergence,proof from secrefsecassumptions,proof from secrefsecmild assumption gradient,proof from secrefsecconvergence with constant probability,proof from secrefsecspherically symmetric
Latex/200111242.tex,introduction,background,experiment,result,discussion,conclusion
Latex/200205777.tex,introduction,semistructured deep distributional regression,implementation detail,numerical experiment,benchmark study,application to multimodal data,conclusion,proof,supplementary material,detail on computing environment
Latex/200107455.tex,introduction,the machine learning curve for designer,impact for humancentered machine learning
Latex/200201014.tex,introduction,four principle of explainable ai,related work,dance floor perspective,case study,conclusion
Latex/200101893.tex,introduction,experimental setting,formulation,method,experiment,discussion
Latex/200109330.tex,introduction,a particular rnn the lstm,implementation,conclusion
Latex/200205784.tex,introduction,related work,method,experiment setup,result,conclusion,appendix a similarity configuration evaluation,appendix b stock similarity exploration
Latex/200100526.tex,introduction,related work,proposed efficient residual densely connected cnn,experimental result,discussion,conclusion
Latex/200108090.tex
Latex/200204155.tex,introduction,motivation and related work,forecastnet architecture,forecastnet property,material and method,result and discussion,summary and conclusion,additional result,additional model detail,detailed derivation of interleaved output chain rule in equation refeqchainrule2
Latex/200200232.tex,introduction,problem formulation,algorithm for meanvariance mab,regret analysis,numerical simulation,conclusion,figure and more numerical result,proof of theoremrefthm thm3,proof of theoremrefthm thm2,proof of theorem refthm thm4
Latex/200110652.tex
Latex/200102792.tex,introduction,generalization of gail,computation of gail,experiment,discussion,proof in section refgeneralization,proof of theorem refthmsgdconverge,proof of theorem refthmmainempiricalmaxi
Latex/200104244.tex,introduction,related work,methodology,result and discussion,conclusion
Latex/200104625.tex,introduction,related work,asymmetric correlation quantization hashing,algorithm design and analysis,experiment,conclusion
Latex/200111801.tex,introduction,notation and concept,noise2inverse,result,discussion,conclusion
Latex/200201883.tex,proof,hyperparameter tuning,a comparison based on final performance
Latex/200100637.tex,introduction,methodology,related work,example,conclusion
Latex/200104263.tex,introduction,formulation,methodology and result,conclusion
Latex/200101046.tex,introduction,related work,method,theoretical insight,experiment,conclusion
Latex/200110190.tex,introduction,related work,proposed model,experimental evaluation,conclusion
Latex/200204724.tex,introduction,improved consistency regularization,experiment,ablation study,related work,conclusion,gan loss,evaluation in inception score,hyperparameters effect on performance,additional quantitative result,qualitative example
Latex/200200666.tex,introduction,example,distributed firstorder logic,an example encoding the peano axiom,conclusion,acknowledgement
Latex/200205149.tex,introduction,interpretation explanation and selfexplanation,why deep neural network are generally noninterpretable,challenge in building trustworthy selfexplaining ai,ensuring robustness through applicability domain and uncertainty analysis,conclusion
Latex/200103002.tex,introduction,background,related work,proposed architecture,evaluation,conclusion and future work
Latex/200204632.tex,introduction,method,related work,experiment,conclusion,surrogate implementation detail,bias of the estimator,optimization implementation detail,detail of the physic problem,grid search of optimal parameter
Latex/200106927.tex,reasoningvqa and data,dataset analysis,fine grained evaluation of vqa reas,perceptionvqa v reasoningvqa,data
Latex/200111402.tex,introduction,related work,problem definition,graph convolution machine gcm,experiment,conclusion and future work
Latex/200108625.tex,introduction,material method,result,discussion
Latex/200201245.tex,introduction,the regression tsetlin machine rtm,stochastic searching on the line,regression tsetlin machine with weighted clause,empirical evaluation,conclusion
Latex/200110820.tex,introduction and motivation,background,experiment and replication,conclusion and acknowledgement
Latex/200200748.tex,introduction,problem formulation,model description,evaluation,related work,conclusion
Latex/200106058.tex,introduction,background,experiment,permutation test for graph,permutation test for shape,analysis and visualization,conclusion and future work,concept,diagram statistic,vector method for pd,kernel method for pd,hyperparameters choice,datasets description
Latex/200109249.tex,introduction,related work,heterogeneity impact study,proj a tierbased federated learning system,experimental evaluation,conclusion
Latex/200108155.tex,introduction,related work,spark based anomaly detection framework sadf,sadf scientific datasets,testbed design step,experiment and result analysis,conclusion
Latex/200109386.tex,introduction,problem description,the newshead dataset,learning framework,the nhnet model,experimental setting,experiment result,case study,related work,conclusion
Latex/200101620.tex,introduction,method,result learning optimal option under time constraint,conclusion
Latex/200200541.tex,introduction of neural network,aoa estimation by neural network
Latex/200200790.tex,introduction,autonomous learning of pdf equation and their closure approximation,result,conclusion and discussion,derivation of the pdf equation,derivation of the joint pdf equation,derivation of closure approximation
Latex/200202870.tex,introduction,processing framework and theoretical background,evaluation,conclusion and discussion
Latex/200205138.tex,introduction,preliminary,related work,lower bound,upper bound,technical discussion,proof of theoremrefthm lb2,proof of lemmareflem basic,proof of lemmareflem diffexpansion,proof of lemmareflem diffbound
Latex/200110509.tex,introduction,fuseinit mseoptimal neural network initialization via layer fusion,experimental result,conclusion,proof of frefthmlinearizefc,proof of frefcormseexpression,proof of frefthmequivalentgeneralconv
Latex/200103659.tex,introduction,our approach,experiment,conclusion
Latex/200109608.tex,introduction,a prototype lifelong reinforcement learning system,experiment,conclusion
Latex/200203388.tex,introduction,related work,model,task description,datasets and experimental setup,evaluation and result,discussion and future work,conclusion
Latex/200102463.tex,introduction,contextual constrained clinical trial c3t model,c3t with limited budget,discussion,experiment,conclusion,preliminary,proof of theorem 2,worstcase reget bound for total efficacy of c3tbudgete,description of c3tbudgete,description of baseline algorithm
Latex/200107712.tex,introduction,related work,method,experiment and result,conclusion
Latex/200101077.tex,introduction,tensor singular value decomposition,quantum machine learning algorithm for knowledge graph,experiment with classical tensor svd,conclusion,appendix
Latex/200202007.tex,introduction,background and related work,defense via semantic feature manipulation,experiment,conclusion
Latex/200111688.tex,introduction,endtoend dnn baseline,framework for exploitingsubsidiary information,experimental setting,result and analysis,conclusion
Latex/200107524.tex,introduction,a brief history of gnns,theoretical framework,analysis of aggregationbased gnns,node masking,experiment,conclusion,varying the node masking rate,analysis of loss curve
Latex/200101683.tex,introduction,deep innovation protection,experiment,experimental result,related work,discussion and future work,broader impact,acknowledgment
Latex/200108682.tex,introduction,preliminary,related work,expected information maximization,evaluation,conclusion,pseudo code labelapcode,derivation labelapbound,elaboration on related work,visualization of sample,hyperparameters labelapexperiments
Latex/200203518.tex,introduction,related work,method,result,analysis,conclusion,appendix
Latex/200103311.tex,introduction,proposed method,experiment,conclusion,other objective representation form,detailed implementation of maximum mean discrepancy,proposed algorithm,why compression improves adversarial robustness,related work,experiment detail,supplementary experimental result
Latex/200205753.tex,introduction,augmented lagrangian in boosting,experiment,conclusion
Latex/200105819.tex,introduction,derivation of gsdar,theoretical property,adaptive gsdar,simulation study and real data analysis,conclusion,appendix
Latex/200103750.tex,introduction,problem setup,architecture,theory of sympnets,simulation result,summary,proof for universal approximation theorem
Latex/200102391.tex,introduction,general fuzzy minmax neural network,proposed method,experiment,conclusion and future work
Latex/200111939.tex,introduction,problem statement,odr online douglasrachford splitting,dynamic regret analysis for odr,odista distributed online ist,dynamic regret analysis for odista,numerical result,conclusion
Latex/200201065.tex,introduction,causality applied to fake news and related work,generating a weighted causal graph from text causal relation,detecting fake news,experiment,conclusion and further work
Latex/200201043.tex,related work,preliminary,noise injection in controlled orientation,textitsampling zone design,proposed algorithm and it analysis,experimental evaluation,conclusion,introduction
Latex/200104186.tex,introduction,procedure for collecting the textual instruction,dataset,conclusion
Latex/200111216.tex,introduction,related work,how doe bnrelu make network parameter sparse,why doe bn relu make network parameter sparse,proposed method of avoiding sparsity,conclusion
Latex/200202919.tex,introduction,a brief review of stochastic gradient langevin dynamic,an extended stochastic gradient langevin dynamic algorithm,an illustrative example,discussion
Latex/200102121.tex,introduction,distributional modelling,catboostlss,related research,application,software implementation,conclusion,munich rent quantile loss comparison
Latex/200108961.tex,introduction,related work,proposed approach,experiment,discussion and conclusion
Latex/200108687.tex,introduction,related work,method,experimental setup,result,conclusion
Latex/200110399.tex,introduction,related work,qualitydriven active learning alg,evaluation,result,conclusion
Latex/200106007.tex,introduction,related work,modeling the approach,adaptive intent and pattern detection,model of semantic similarity,experiment,discussion
Latex/200205059.tex,introduction,goldilocks activation,property of goldilocks activation,numerical result,conclusion
Latex/200202393.tex,introduction,related work,methodology,experiment,discussion,conclusion
Latex/200106137.tex,introduction,related work,the proposed model,module,experiment,conclusion
Latex/200102872.tex,introduction,no free lunch theorem,context and definition,effective neighbourhood search,cardinalitymonotonicity,neighbour with similar fitness nsf,condition for local improvement to be effective,proof that cardinalitymonotonicity and nsf justify neighbourhood search,conclusion
Latex/200202315.tex,introduction,related work,background,the decoding algorithm,experimental setup and result,conclusion
Latex/200106597.tex,introduction,pet ac,lowcount pet reconstruction,summary and outlook
Latex/200109244.tex,introduction,related work,system overview,workflow,proof of useful work,implementation,discussion,conclusion,anatomy of transaction,shortening task wait time,a distributed key generation dkg scheme,signing emphtofn transaction,crashrecovery model,performance of the ml distributed system
Latex/200203239.tex,introduction,preliminary and notation,general iid smoothing,generalized gaussian smoothing,uniform smoothing,experiment,conclusion,proof for lemmareflemexpbnd,additional plot of certificate upper bound,experimental detail
Latex/200105918.tex,introduction,elastic consistency,elastic consistency and sgd convergence,distributed system model and their elastic consistency bound,practical application elastic scheduling,related work and discussion,detailed proof,elastic consistency bound,additional experiment
Latex/200101596.tex,introduction,part 2 brake squeal prediction,conclusion,brake noise detection and characterization,brake squeal prediction
Latex/200203746.tex,introduction,related work,problem formulation,adversarial autoencoders,adversarial black box explainer,experiment,conclusion
Latex/200110916.tex,introduction,literature review,method,interpretation,conclusion
Latex/200100572.tex,introduction,related work,skim and intensive reading model,experiment,result and analysis,conclusion,acknowledgment
Latex/200111539.tex,introduction,related work,the approach,generative model with acl,experiment,conclusion and future work
Latex/200204971.tex,introduction,background,methodology,implementation detail,result and experiment,prior work on accelerating dnns for fpgas,conclusion
Latex/200107910.tex,introduction,related work,overview of compvae,experimental setting,compvae empirical validation,discussion and perspective,model structure,data generation,multivariate gaussian parametrization
Latex/200102205.tex,expansion of ep rate in multipartite process,proof that if a is a community then dfracdadt sx xat ge 0,proof of crefeq30a,ep bound from the inclusionexclusion principle
Latex/200109849.tex,introduction,related work,methodology,experimental validation,conclusion
Latex/200204397.tex,introduction,related work,concept and problem definition,proposed method,experiment,conclusion
Latex/200201092.tex,introduction,case study rationale generation,whats next turn to the sociotechnical,humancentered xai critical technical practice and the sociotechnical lens,conclusion
Latex/200106917.tex,introduction,related work,background,methodology,evaluation,discussion and outlook
Latex/200104980.tex,introduction,data set,methodology,experiment,result and discussion,conclusion
Latex/200108559.tex,introduction,related work,information compensation in gans,evaluation,inspecting the feature internally encoded,conclusion,appendix
Latex/200200865.tex,introduction,a class of function phizpsiz,datadriven setup and neural network,experiment,conclusion
Latex/200202645.tex,introduction,intuition,freeze inference design,result and challenge,research direction,discussion topic
Latex/200106640.tex,introduction,background,algorithm,experiment,related work,conclusion
Latex/200104536.tex,introduction,method,result,summary and discussion,appendix
Latex/200111853.tex,introduction,mathematical background,gateauxhopfield neural network,the prototype system,the numerical solution,convergence dependence on alpha and psi,learning time evolution,conclusion,numerical solution of fractional differential equation,conformable hopfield neural network equation the fractional order case,convergency to fix point dependency on alpha
Latex/200205988.tex,introduction,background,fraud detection system,experiment,conclusion
Latex/200202530.tex
Latex/200107252.tex,conclusion
Latex/200205273.tex,electronic submission,format of the paper,do emphnot have an appendix here
Latex/200203786.tex,introduction,data,method,result,discussion
Latex/200201969.tex,introduction,cyberphysical threat model,methodology twoplayer posg,experimental evaluation,conclusion
Latex/200202405.tex,introduction,cold posterior perform better,bayesian deep learning in practice,inference is it accurate,why could the bayes posterior be poor,alternative explanation,related work on tempered posterior,conclusion,model detail,deep learning parameterization of sgmcmc method,connection to stochastic gradient descent sgd,semiadaptive estimation of layerwise preconditioner mathbfm,kullbackleibler scaling in variational bayesian neural network,inference biasvariance tradeoff hypothesis,cold posterior improve uncertainty metric,detail on the experiment for the implicit initialization prior in sgd hypothesis,diagnostics temperature,simulation accuracy ablation study,dirty likelihood function,prior predictive analysis for different prior scale,tempering the observation model,detail generation of a synthetic dataset based on an mlp drawn from it prior distribution,detail about hamiltonian monte carlo
Latex/200202735.tex,introduction,frontend modeling,backend modeling,system submitted,posteval experimenents and analysis,summary and conclusion
Latex/200101799.tex,introduction,mdp formulation and radar system model,experimental method,experimental result and discussion,conclusion
Latex/200200539.tex,introduction,related work,neuroevolution of reverse encoding tree,experiment,result,discussion,conclusion
Latex/200202848.tex,introduction,related work,approach,experimental setting,result,conclusion,supplementary method,supplementary result
Latex/200205115.tex,introduction,material and method,result,discussion,outlook and conclusion,hyperparameters,performance difference to older experiment,neural network parameter,riemanniangeometrybased decoding,three model ensemble error
Latex/200111631.tex,introduction,related work,enhancement of clustering by iterative classification,similarity matrix sparsification,method for clustering of short text,experiment,conclusion and future work,reference,parameter tuning of iterative classification
Latex/200105419.tex,introduction,background,residual flow for ood detection,related work,experiment,conclusion,acknowledgment,comparison proposed approach v lda mahalanobis and gda model,alternative architecture
Latex/200105166.tex,introduction,related work,shapevis,experiment,conclusion
Latex/200203469.tex,introduction,preliminary,projected stein variational gradient descent,numerical experiment,conclusion,proof of theorem refthmpsvgd,a linear inference problem
Latex/200103032.tex,introduction,related work,ourdataset virtual pedestrian dataset,domain adaptation for synthetic2real pedestrian detection,experimental evaluation,conclusion
Latex/200202096.tex,conclusion,proof of the first zonklar equation,introduction
Latex/200202360.tex,introduction,related work,extrusion sequencing,robotic extrusion,algorithmic tool,progression,regression,result,conclusion,stiffness planning,theoretical result,extrusion benchmark
Latex/200108103.tex,introduction,ml for healthcare application,secure private and robust ml for healthcare challenge,secure private and robust ml for healthcare solution,open research issue,conclusion
Latex/200106627.tex,introduction,background,approach,simulation result,conclusion
Latex/200107394.tex,introduction,related work,preliminary,automatic domain selection dimensionality reduction,simulation and experiment,conclusion
Latex/200101051.tex,introduction,related work,model architecture,experiment,sensitivity analysis,conclusion
Latex/200203766.tex,introduction,motivation,related research,decomposition into tensor,experimental result,discussion,appendix
Latex/200202572.tex,introduction,related work,multimodal controller,experiment,conclusion,experimental detail
Latex/200106232.tex,introduction,related work,sideways,experiment,conclusion
Latex/200100766.tex,introduction,three stability result,mathematical detail and proof,application significance and discussion
Latex/200101072.tex,introduction,linear region,property of the linear region,discussion and conclusion,acknowledgment,illustration on a toy dataset,calculate parameter of the inequality,remove redundant inequality,mathbfxt lie on the face of the linear region in most case
Latex/200204363.tex,introduction,main contribution,proof of the main result,wellposedness of eqrefsdey,assumption eqrefassumptiona3 v relative strong convexity and eqrefassumptiona4 v relative smoothness,proof of a stronger version of proposition refpropbaillonhaddadextendweak the baillonhaddad type inequality,proof of proposition refcorconstantstepsize corollary refcorcontractionball and proposition refpropmainproofphi
Latex/200108883.tex,introduction,research effort,challenge and gap,conclusion and recommendation
Latex/200111349.tex,introduction,related work and context,background,main result,applying the framework,an extension to psdds,discussion and conclusion
Latex/200108830.tex,introduction,gait signal,feature extraction,result,conclusion
Latex/200105972.tex,introduction,method,result,conclusion
Latex/200106001.tex,introduction,related work,method pseudolabeling under curriculum,theoretical analysis,experiment,conclusion,appendix
Latex/200205308.tex,introduction,problem setting,adaptive policy for efficient ate estimation,sequential hypothesis testing with a2ipw estimator,main algorithm aerate,experiment,conclusion,preliminary,proof of propositionrefoptprob,proof of theoremrefthmasympdista2ipw,proof of theoremrefthmregret,a2ipw estimator for offpolicy evaluation,further discussion of related work,detail of statistical hypothesis testing,detail of main algorithm aerate,detail of experiment
Latex/200100786.tex,introduction,background,decisionmaking module,experiment,conclusion
Latex/200203785.tex,introduction,prior work,multilevel prosody modeling structure,interpretable conditional vae structure,experiment,conclusion,acknowledgement
Latex/200203862.tex,introduction,state of the art,crossmodal vae for music transcription,experiment,result,discussion and future work,conclusion
Latex/200112004.tex,introduction,related work,neural mmo,the io problem,distributed infrastructure,experiment,discussion and limitation,conclusion,acknowledgment
Latex/200205291.tex,introduction,background,csmnn framework,experiment and simulation result,conclusion and future work
Latex/200203123.tex,introduction,preliminary,from bounded sq dimension to bounded memory learning,from bounded memory learning to bounded sq dimension,omitted proof
Latex/200104693.tex,introduction,related work,evaluating the influence of data subset on word embeddings,method,result,discussion
Latex/200104533.tex,introduction,datasets,the graphbased forward model,the optimization process,experimental result,scalability and graph sparsification,related work,conclusion and future work
Latex/200108972.tex,introduction,related work,method,result on largescale image retrieval,ablation study,implementation detail,conclusion,result reported in fpr95 on ubc patch,l2net architecture,secondorder attention map on patch
Latex/200201955.tex,introduction,related work,proposed method,experiment
Latex/200205459.tex,introduction,related work,method,experimental setup and evaluation metric,evaluation and result,conclusion
Latex/200105119.tex,introduction,related work,endtoend multiview 3d registration,network architecture,experiment,conclusion,supplementary material,supplementary material
Latex/200101128.tex,introduction,related work,minhash sketch,method,performance evaluation,conclusion
Latex/200205466.tex,introduction,background,algorithm and convergence analysis,extension to smooth nonconvex function,numerical evaluation,conclusion,proof of lemmareflemxdiffnonsmooth,proof of lemmareflemvfuncnonsmooth,proof of lemmareflemwfuncsmooth,proof of theoremrefthrmsmoothcomplexity,proof of theoremrefthrmsmoothunconstrainedcomplexity
Latex/200108525.tex,introduction,motivating example,framework overview,react modeling language,controller synthesis,evaluation,limitation issue,related work,conclusion
Latex/200103955.tex,introduction,information bottleneck learning,information bottleneck quantization,variational approach to ib learning,aggregated learning agrlearn,experimental study,conclusion,acknowledgment,appendix
Latex/200108688.tex,introduction,preliminary,modeltheoretic characterization,application complexity of rewritability,conclusion and related work,appendix detailed proof
Latex/200105545.tex,introduction,proposed approach,related work,experiment and result,conclusion
Latex/200203809.tex,introduction,synthetic fingerprint generation,synthetic database creation,experimental result,conclusion
Latex/200200057.tex,introduction,preliminary,upper bound for extragradient,conclusion and future work,discussion,proof of lemma reflemabexist and reflemabdiff,proof of last iterate convergence of proximal point,cli with timevarying coefficient
Latex/200204116.tex,introduction,background and challenge,problem definition,proposed coexploration framework placeholder,experimental evaluation,conclusion
Latex/200110220.tex,introduction,related work,experimental setup,catching approach,experiment,conclusion
Latex/200101248.tex,introduction,methodology,experiment and result,conclusion
Latex/200204665.tex,introduction,method,experiment,discussion and challenge,conclusion
Latex/200204862.tex,introduction,definition and related work,plausible counterfactual explanation,experiment,discussion and conclusion,proof and derivation
Latex/200105202.tex,introduction,preliminary,randomized bregman coordinate descent,convergence analysis of rbcd,accelerated randomized bregman coordinate descent,convergence analysis of arbcd,efficient implementation,numerical experiment,conclusion,appendix
Latex/200203230.tex,introduction,background and motivation,hierarchical graph generation,experiment,related work,conclusion,motif construction,network architecture,experimental detail
